title,date,press,contents,link
무상급식·혁신학교에 입시구조 손질도 시동 : 네이버 뉴스,2010.06.03,media KHAN,"ㆍ연대 나선 진보교육감ㆍ창의·학생인권 초점, 교과과정 개선 추진6·2 지방선거에서 6명의 진보 교육감 후보가 당선되면서 교육현장에 어떤 변화를 가져올지 주목된다. 특히 우리나라 교육정책에 가장 큰 영향을 미치는 서울과 경기 교육감에 진보 후보가 나란히 당선돼 파장은 적지 않을 전망이다. 당장 곽노현(서울)·김상곤(경기)·민병희(강원)·김승환(전북)·장만채(전남)·장휘국(광주) 등 진보 교육감 당선자들은 연대를 통해 교육현장을 바꿔나가겠다는 의지를 밝히고 나섰다.곽노현 당선자는 3일 기자회견에서 “전국에 탄생한 6명의 진보 교육감은 저와 비슷한 철학과 소신을 갖고 계실 것”이라며 “향후 교육감협의회 등을 통해 교육에 관한 본격적인 협의를 진행해 나갈 것”이라고 밝혔다. 김승환 당선자도 “김상곤 당선자 및 곽 당선자와 철저한 정책연대를 할 것”이라고 말했다.이들은 우선 학생들의 인권을 강화하는 활동을 함께 진행할 것으로 예상된다. 현 경기도교육감인 김상곤 당선자는 지난해 경기도 학생인권조례를 제정한 바 있으며, 여기에는 곽노현 당선자도 참여했다. 또 이번 선거에 앞서 진보 교육감 후보들은 학생인권조례 제정을 공동 공약으로 채택했다.경기도의 학생인권조례에는 ‘체벌 금지’ ‘학생의 야간자율학습, 보충수업 선택권 보장’ ‘두발 길이 규제 금지’ ‘휴대폰 소지 자체 금지 제한’ 등 그동안 일부 교사들과 보수진영에서 반대했던 인권보장 조항들이 많이 담겨 있다.이에 따라 진보 교육감 후보가 당선된 지역의 학교 분위기가 지금보다 훨씬 자유로워질 것으로 예상된다.이들은 또 자립형사립고 등 현 정부의 ‘경쟁’ 위주 교육에 반대해 ‘균형’을 강조하고 있다. 대표적인 것이 ‘혁신학교’다. 김상곤 교육감은 경기도에서 33개교를 혁신학교로 지정해 운영하고 있다. 혁신학교는 과대학교, 과밀학급을 재편해 한 학년을 5개반 이하, 학급당 학생 수를 25명 이내로 줄여 교육과정 운영에 일정 부분 자율권을 보장한 학교를 말한다. 진보 교육감들은 상대적으로 소외된 지역에 이 같은 혁신학교를 만들어 질 높은 교육을 확대한다는 계획이다.학생들이 치르는 ‘일제고사’ 횟수는 지금보다 줄어들 것으로 보인다. 교육감이 관할하는 시험은 표집방식으로 바꾸고, 교과부 주관 시험에서도 학생 선택권을 보장할 방침이기 때문이다. 또 수업은 토론식을 확대하고, 평가방식은 서술형 중심으로 전환하는 등 창의력 중심으로 교과과정을 개선하겠다는 계획을 갖고 있는 교육감이 많다. 현행 교원평가 제도에도 많은 변화가 예상된다.<심혜리 기자 grace@kyunghyang.com>[관련기사]▶ 사학비리 맞선 해직교사, 교육의원으로 귀환▶ 곽노현 “자율고 더 안만들고 등록금도 낮출 것”▶ 경쟁 중심 ‘줄세우기 교육’ 대수술 예고▶ 당황한 정부·보수 교육계 ‘긴장’- 대한민국 희망언론! 경향신문, 아이폰 애플리케이션 출시 - ⓒ 경향신문 & 경향닷컴(www.khan.co.kr), 무단전재 및 재배포 금지〈경향닷컴은 한국온라인신문협회(www.kona.or.kr)의 디지털뉴스이용규칙에 따른 저작권을 행사합니다.〉",https://news.naver.com/main/read.nhn?mode=LSD&mid=sec&sid1=100&oid=032&aid=0002068168
학부모들의 손에는 입시자료 : 네이버 뉴스,2010.05.08,뉴시스,【서울=뉴시스】박종민 기자 = 8일 오후 서울 용산구 숙명여자대학교에서 열린 '2010년 대입설명회'를 찾은 학부모와 학생들이 관계자의 설명을 듣고 있다. jmc@newsis.com,https://news.naver.com/main/read.nhn?mode=LSD&mid=sec&sid1=102&oid=003&aid=0003228572
현직교사가 알려주는 ‘대입 맞춤전략’ : 네이버 뉴스,2010.04.11,The Internet Hankyoreh,"[한겨레] 한터, 고교생 학부모들 위한 특강 마련 얼마 전 고교생들은 3월 모의고사 결과를 받아들었다. 고교 3학년이라면 당장 이 결과를 놓고 과목별 약점을 분석하는 한편 수시 지원전략을 세워 준비를 해야 한다. 고교 1~2학년들도 전국에서 과목별로 위치와 수준을 파악할 수 있어 향후 대입 공부의 방향을 정하는 데 활용해야 한다. 한겨레교육문화센터는 신촌과 분당 센터에서 고교 1~3학년 수험생 학부모들을 대상으로 현직교사가 알려주는 대입 맞춤전략 특강을 연다. 이번 특강은 대입 제도의 변화 속에서 고교생 학부모들의 현실적 고민을 풀어주기 위해 마련되었다. 내신 관리는 얼마나 해야 하는지, 수상 실적과 리더십, 공인외국어성적 등의 비교과 영역은 대학 가는 데 얼마나 도움이 되는지, 수능이 약하다면 수시에서 어떤 전략을 세워야 하는지, 내신이 약할 때는 수시를 어떻게 준비해야 하는지, 수시와 정시 전략은 어떻게 연동해야 하는지 등을 알려준다. 이화여대부고 입시전략부장이자 전국 진학담당 교사들을 대상으로 수시전략 등을 강의하고 있는 박권우 교사가 나선다. 신촌센터(hanter21.co.kr)에서는 4월30일 오후 5시30분부터, 분당센터(hanedu21.co.kr)에서는 5월1일 오후 2시부터 4시간에 걸쳐 강의가 진행된다. 자료집도 제공한다. 수강료는 4만원. 문의 신촌 (02)3279-0900, 분당 (031)8018-0900.   이란 기자 rani@hanedui.com 세상을 보는 정직한 눈 <한겨레>  [한겨레신문 구독 | 한겨레21 구독]공식 SNS 계정: 트위터 www.twitter.com/hanitweet / 미투데이 http://me2day.net/hankyorehⓒ 한겨레신문사, 무단전재 및 재배포 금지<한겨레는 한국온라인신문협회(www.kona.or.kr)의 디지털뉴스이용규칙에 따른 저작권을 행사합니다.>",https://news.naver.com/main/read.nhn?mode=LSD&mid=sec&sid1=102&oid=028&aid=0002038717
대입 이중등록 위반자 2737명 달해 : 네이버 뉴스,2010.05.07,세계닷컴,"2008년부터 2년간… 합격 취소는 79명 불과대학입시가 정부에서 한국대학교육협의회(대교협)로 이관된 지난 2008년부터 지난해까지 2년간 수시와 정시에 ‘이중합격’하고도 합격이 취소되지 않은 학생이 무려 2600여명에 달하는 것으로 확인됐다.7일 대교협이 진보신당 조승수 의원에게 제출한 ‘대학 입시지원방법 위반자 현황’에 따르면 전국 대학의 2008∼2009년 수시와 정시모집에 동시에 합격한 이중등록 위반자는 모두 2737명에 달했다.고려대 등 주요 사립대를 포함한 4년제 대학 100곳 이상이 해마다 많게는 20명까지 이중등록자를 입학시켰다. 이 가운데 합격이 취소된 이중합격자는 불과 79명에 불과했고, 나머지 2658명은 버젓이 대학에 입학한 것으로 확인됐다. 현행 고등교육법에는 수시에 합격한 학생은 정시에 지원하는 것이 금지돼 있다.이같은 이중합격자는 2005년 2607명, 2006년 2085명, 2007년 1672명으로 꾸준히 줄고 있긴 하지만 복수지원 및 이중등록 위반자에 대한 처분이 사실상 ‘형식’에 그친다는 것이 문제다. 대교협은 이중등록 학생을 대상으로 심의를 거쳐 각 대학에 입학취소를 통보하고 있다. 하지만 대학관계자들로 구성된 심의위원회는 학생의 고의성이 입증되지 않았다는 소명서만으로 이를 구제해주고 있다. 이중등록을 금지시킨 것은 우수학생이 진학의 기회를 독점하지 못하도록 하기 위한 것으로, 이같은 솜방망이 처분으로 결국 2600여명에 달하는 학생들이 피해를 봤다는 결론이 나온다.조 의원은 “심사위 자체가 근원적인 한계를 가지고 있는 구조”라며 “최종 심사가 1학기가 끝날 때 이루어짐으로써 입학을 취소하면 새로 추가모집이 불가능해져 대학으로서는 등록금 손실을 보지 않기 위해서라도 대부분을 구제해주고 있는 실정”이라고 말했다.김기동 기자 kidong@segye.com [Segye.com 인기뉴스]◆ 천안함 北 소행 때 한미 대응 시나리오는◆ 이병헌, '절친' 이범수 결혼식 사회 맡았다◆ 차수연, 파격적인 화보 '눈길'…신비롭고 섹시한 매력!◆ '잘못 건 전화 때문에'… 특전사 출신·조폭 '맞짱'◆ '대국남아' 가람 ""소 성기 먹을때 아찔했다""◆ 옥주현 ""'핑클' 시절, 이진과 자존심 대결 심했다""◆ 중국 네티즌들 ""김정일은 중국을 떠나라"" 비난    [ⓒ 세계일보 & Segye.com, 무단 전재 및 재배포 금지]  [☞공짜로 연극ㆍ뮤지컬보기] [세계일보 음악콩쿠르 신청]  <세계닷컴은 한국온라인신문협회(www.kona.or.kr)의 디지털뉴스이용규칙에 따른 저작권을 행사합니다.>",https://news.naver.com/main/read.nhn?mode=LSD&mid=sec&sid1=102&oid=022&aid=0002137572
대입 비중 커질 비교과 영역 준비 요령 : 네이버 뉴스,2010.04.09,연합뉴스,"고교 1학년부터 서두르면 일거양득 효과    (서울=연합뉴스) 이준삼 기자 = 수시모집이 확대되고 소질과 적성, 인성, 잠재력 등을 고려해 학생을 뽑는 입학사정관제가 도입됨으로써 대학입시에서 비교과 영역의 비중이 갈수록 커질 전망이다.    비교과 영역은 각 대학이 독자적 기준으로 평가하므로 대비하기 쉽지 않지만, 고교 1∼2학년부터 차분하게 준비하면 3학년 때는 수학능력시험에만 전념할 수 있어 일거양득의 효과를 거둘 수 있다고 입시학원들이 조언했다.    9일 입시전문업체인 메가스터디에 따르면 생활기록부에는 인적, 학적, 출결, 수상경력, 자격증/인증취득, 진로지도, 재량활동, 특별활동, 교외 체험학습, 교과학습 발달, 독서활동, 행동특성 및 종합의견 등 12개 항목의 비교과 영역이 기록된다.    이중 자격증, 독서활동, 수상실적, 기타 교외활동(봉사활동 등) 등이 학생들이 중점적으로 준비해야 할 부분이다.    봉사활동이든 특별활동이든 지원을 희망하는 전공과 관련 있는 분야에서 꾸준히 노력하고 그 근거를 남겨놓는 것이 중요하다.    메가스터디는 ""본인의 활동 이력이 실린 지역 신문, 사진, 활약상을 기록한 보고서 등이 근거로 활용된다. 역사학자가 꿈인 학생이라면 노인 복지시설보다는 문화재 관련 기관에서 활동하면 더 좋은 평가를 받을 수 있다""고 조언했다.    자기소개서와 포트폴리오는 미리 작성해놓고 변동사항이 생길 때마다 고치는 것이 좋다.    인성, 잠재력, 미래에 대한 포부 등 자신의 삶을 압축적이고 효과적으로 보여주려는 것이 자기소개서이므로, 고3 때 허겁지겁 작성하려면 쉽지 않기 때문이다.    일단 한 번 써보는 것이 중요하며 담임교사 등의 조언을 토대로 지속적으로 보완해나가는 것도 요령이다. 스스로 계획한 부분을 성취하려고 본인이 노력한 부분들이 부각되도록 구성해야 한다.    수학ㆍ과학ㆍ논술 경시대회 등 교내외 대회 수상실적이나 각종 능력시험에서의 공인점수, 국가 자격증, 교육과학기술부나 시ㆍ도교육청 주관 및 학교장 추천 대회 수상 실적 등도 대입에서 유리하게 작용할 수 있으므로 특별히 신경 써야 한다.    jslee@yna.co.kr<뉴스의 새 시대, 연합뉴스 Live> <모바일 애플리케이션> <포토 매거진><저작권자(c)연합뉴스. 무단전재-재배포금지.>",https://news.naver.com/main/read.nhn?mode=LSD&mid=sec&sid1=102&oid=001&aid=0003215454
[2011학년도 대입 전략－ 성균관대] 수시 1차 총 811명，입학사정관 전형으로 선발 : 네이버 뉴스,2010.04.16,한경닷컴,"정시 자연계 우선선발，수능 수리·과탐만 반영성균관대학교는 올해 대학입시 자율화에 따른 수험생의 혼란을 최소화하기 위해 종래의 내신형，논술형，수능형，입학사정관형 등 크게 네 가지의 신입생 선발유형을 그대로 유지하고 지원자격 및 전형방법도 지난해와 비교하여 큰 변화를 두지 않았다.수시와 정시모집의 선발인원 비율은 각각 60%，40%로 확정했으며 모집시기별 선발인원은 수시1차 1183명，수시2차 1248명，정시 1307명이다.올해 발표한 2011학년도 성균관대 입학전형의 주요특징들을 정리해 보면 △수시 지역리더육성전형과 외국고교출신자전형 신설 △입학사정관전형 확대 △정시 수능 우선선발 축소와 기준변경 등으로 요약할 수 있다.특히 수시1차 모집에서 학업우수자전형을 제외한 모든 전형을 입학사정관제로 모집하는데 성균관대를 지망하는 수험생들은 학교 측이 공지한 입학사정관전형 실제 합격자 사례，선발 평가기준，준비방법 등을 꼼꼼히 확인해보고 미리 대비하는 것이 좋다.⊙ 학업우수자전형은 일반고 학생만 지원 가능372명을 모집하는 학업우수자전형은 순수 학생부 중심 전형으로 전문계고，특수목적고를 제외한 일반고학생들만 지원 가능하며 학생부 중 교과 80%，비교과 20%를 일괄 합산하여 합격자를 선발한다.하지만 사범대，건축학，영상학，스포츠과학부에 한해 단계별 전형을 실시하며 2단계에서 면접을 실시한다는 점에 유의하도록 하자.수시1차모집에서는 학업우수자전형과 지역리더육성전형만 수능 최저학력기준이 적용되는데 인문계의 경우 언수외 합산 6등급이내，자연계는 언수외탐 중 3개영역 합산 6등급 이내다.⊙ 수시1차 8개전형 입학사정관제로 선발수시1차모집에서 학업우수자전형을 제외한 글로벌리더전형，리더십전형 등 8개전형이 모두 입학사정제로 선발한다.입학사정관제 모집인원은 지난해 총 626명에서 올해 811명으로 확대되었고 입학사정관제 전형 가운데 리더십전형과 자기추천전형은 서류평가부터 면접까지 모든 과정에 입학사정관이 참여한다.전형별로 살펴보면 우선 글로벌리더전형은 Ⅰ，Ⅱ로 구분하는데 Ⅰ은 TOEFL，TEPS 등 어학성적이 대학 측이 제시한 일정 수준 이상이 되어야 하며，Ⅱ는 해외고교 졸업(예정)자에 한해 지원자격이 주어진다.리더십전형은 총학생회장，부총학생회장，학급회장 2회 이상의 임원 경력이 있어야 지원 가능하며 활동기록보고서，고교장추천서，학생부 비교과영역 등이 서류평가로 반영된다.성균관대에서 치러지는 입학사정관전형들은 대개 2단계에서 면접이 실시되는데 인문계는 언어 및 사회교과(영어지문 포함)，자연계는 수학교과 관련 문제가 출제되며 면접시간은 10~15분이다.입학처 홈페이지 자료실(http;//admission.skku.edu)에서, 면접 기출문제는 물론 모범답안，평가기준표를 반드시 확인해보도록 하자.⊙ 올해 처음 지역리더육성전형 신설지역리더육성전형은 농 · 어촌 · 산간 벽지 지역의 숨어 있는 인재를 발굴，사교육의 도움 없는 자기 주도성이 강한 인재 선발을 목적으로 올해 처음 신설되었다.총 150명을 선발하며 학업우수자전형과 더불어 수능 최저학력기준을 적용한다.행정구역상 읍，면이 아니더라도 신활력지역으로 선정된 태백시，남원시，김제시，나주시，상주시，문경시 소재 고교학생들은 지원이 가능하다.지육리더육성전형은 물론 입학사정관제 지원자들은 성균관대가 발표한 평가의 핵심인 '신 성균인재상'(교양인 · 전문인 · 리더십)에 초점을 맞춰 단순히 '스펙쌓기'보다는 스스로 노력한 과정을 중심으로 평소에 관련 내용을 잘 정리해 두는 습관이 매우 중요하다.⊙ 논술중심전형 수능최저기준 높게 설정수시2차에서 1248명을 모집하는 일반학생전형은 우선선발과 일반선발로 구분하여 신입생을 모집한다.모집정원의 50%를 선발하는 우선선발의 조건은 인문계의 경우 수능 언수외 합 4등급 이내，자연계는 수리와 과탐영역 합산등급 3등급 이내여야한다.일반선발 수능 최저학력기준은 인문계의 경우 언수외 합산 6등급 이내，자연계는 언수외탐 중 3개영역 합산 6등급 이내이며 우선선발대상자는 논술 100%로，일반선발대상자는 학생부 30%와 논술 70%를 반영한다.단 반도체공학과는 우선선발없이 일반선발로만 신입생을 모집한다.성균관대 논술시험은 보통 수능시험 직후 바로 실시되므로 미리 대비하지 않으면 낭패를 볼 수 있다는 점에 유의하자.논술고사는 통합교과형 논술로 인문계는 언어，사회교과에서，자연계는 수리과학에서 4문항이 출제되며 시험시간은 120~150분이 주어진다.성균관대를 지망하는 수험생이라면 성균관대 입학처 홈페이지에 방문하여 '2011 논술특강 동영상'과 '논술가이드북 기초/심화편'을 반드시 숙지하고 지난해 수시 기출문제를 통해 출제유형을 확인하도록 하자.⊙ 정시 학생부반영방법 수시와 달라1307명을 선발하는 정시모집 일반전형은 지난해와 마찬가지로 가，나군으로 분할모집으로 선발한다.가, 군 모두 모집인원의 50%를 수능성적으로만 우선선발하며 나머지 모집인원은 일반선발로 수능70%와 학생부30%를 반영한다.한 가지 유념해야 할 점은 자연계 모집단위에 한해 우선선발 기준을 언수외탐에서 수리와 과탐으로 단순화했다는 것이다.다시 말해 자연계 모집단위의 50%는 수능 수리와 과탐성적만을 반영해 우선선발한다.수능 영역별 반영비율은 인문계는 수리，외국어 각각 30%씩，자연계는 수리，과학탐구영역이 각각 30%로 높게 반영된다.탐구영역은 지원자에게 유리한 상위 3과목을 반영하는데 인문계열은 제2외국어 또는 한문영역을 사회탐구영역의 한 과목으로 대체할 수 있다.반도체시스템공학과는 정시 일반전형에서 유일하게 최저학력기준을 적용한다.학생부 반영방법은 수시에서 계열별로 주요교과 전과목이 반영되는데 반해서 정시에서는 학년별로 4과목만 반영되고 1，2，3학년별 반영비율도 수시 20:40:40과는 다르게 정시에서는 20:30:50의 비율로 반영된다.이동훈 생글 대입컨설팅 소장 dhlee@eduhankyung.com<성공을 부르는 습관>ⓒ 한국경제신문, 무단 전재 및 재배포 금지<한국온라인신문협회의 디지털뉴스이용규칙에 따른 저작권을 행사합니다>",https://news.naver.com/main/read.nhn?mode=LSD&mid=sec&sid1=103&oid=015&aid=0002225138
해마다 선발인원이 증가하는 입시의 블루오션 : 네이버 뉴스,2010.06.29,내일신문,"[내일신문]영어공인점수의 상향평준화로 철저한 내신, 면접, 논술 준비 필요대학 수시모집 전형 중 국제학부전형, 글로벌전형, 영어우수자전형은 해마다 선발인원이 증가해 서울대, 고려대, 연세대 등 주요 11개 대학의 모집 인원만 해도 4천여 명에 이르지만 경쟁률은 6대1로 수시 일반전형에 비해서는 훨씬 낮은 양상을 보인다. 해외거주 경험이 있는 학생이나 외국어에 자신이 있는 학생이라면 한 번쯤 도전해 볼 만한 좋은 기회다. 이 세 전형의 입시에 관한 정확한 내용을 국제학부전형, 글로벌전형, 영어우수자전형 전문 GL에듀어학원 측에 알아보자.  전형의 핵심을 잘 찾아야 유리국제학부는 수능을 보지 않으며 공인영어성적, 내신성적, 심층면접 등을, 글로벌전형은 공인영어점수, 내신, 우리말 논술을 평가하며 대학에 따라 수능 최저 등급을 확보해야하는 조건이 있다. 대부분 영어우수자전형은 공인영어점수의 비중이 절대적으로 높기 때문에 영어실력에 비해 내신이 불리하거나 기타 서류준비가 어려운 수험생이 지원하기에 유리한 전형이다.   최근에는 대학별로 전형방법의 주요 선발 요소가 다소 차이를 보인다. 서울대 특기자 외국어전형 및 연세대 글로벌전형 등은 어학성적 보다 내신 성적을 중요 요소로 평가한다. 그래서 해외 거주 경험이 있는 학생 중에 공인 영어점수가 높더라도 내신 성적이 낮으면 불리하다. 반면 고려대, 이화여대, 서강대, 한국외국어대, 중앙대, 숙명여대 등은 공인영어 점수가 가장 중요해 공인영어점수의 합격선이 높다. 작년의 실제 합격생의 상황을 보면 서강대 알바스트로전형의 인기학과는 토플 117~118점, 비인기 학과는 114점 정도로 보고 있다. 중앙대 경영대는 토플 116점 이상이다. 일반적으로 국제학부에 비해 일반영어 우수자전형이 수월하다. 그러나 최근 국제학부나 일반 우수자전형은 학생의 영어 공인점수가 상향평준화 되어 있는 상황이다. 따라서 공인 영어 점수로만 합격을 장담할 수 없게 되었고 면접이 중요한 부분을 차지하게 되었다. 한승규 원장은 “면접에서 높은 점수를 받으려면 스스로 사회문제에 관심을 갖고 사고력을 키워야한다”면서 “단순히 사교육을 많이 받았다고 해서 해결될 문제가 아니다”라고 말했다. 국제학부는 전망이 있나?영어로 모든 강의가 진행되는 국제학부는 유학을 떠난 것과 환경이 비슷하다는 장점이 있다. 정치, 경제, 사회, 문화 등 다양한 영역에 대해 통합적 학문연구를 하는 21세기에 걸맞는 최고수준의 학부라 평가된다. 국제학부는 2001년도 이화여자대학교를 시작으로 고려대, 한양대, 경희대, 한국외국어대 등 국내 유수의 대학으로 확대되었고 2006년도부터는 연세대학교에서 언더우드국제대학을 출범시켰다. 이후 정원은 점차 증가되는 추세다. 그러나 항간에 국제학부 공부가 졸업 후에 전문성이 없다는 우려의 목소리가 높다. 한 원장은 “한 분야에 전문성을 갖추려면 최소한 석사 이상은 되어야 한다”면서 “국제학부도 다른 학부와 마찬가지로 전문 과정 이전 단계이므로 지식 면에서 큰 차이는 없다”고 설명했다. 오히려 국제학부와 글로벌전형 중에 어떤 것을 선택해야하나 고민한다면 “지원 학생의 대학생활과 학습적성을 고려하는 것이 중요하다”고 한 원장은 강조했다. 국내파 학생으로 어학실력이 해외파 학생에 비해 다소 부족한 부분이 있어도 해외 대학에서 공부해 보고 싶은 의지가 있는 학생이라면 도전해도 된다. 마찬가지로 해외파 학생이라도 국내 대학 생활이 정서에 맞고 공부할 수 있다면 글로벌전형에 도전하는 것도 문제없다.   빨리 결정하고 일찍 준비해야 유리이 세 전형에 도전하기 위해서는 학교공부, 영어공인점수, 영어면접이나 에세이 그리고 우리말 논술 등 세 측면의 공부를 균형 있게 준비해야한다. “내신 반영 비중이 높은 것은 아니지만 해마다 지원학생의 내신 수준이 높아지고 있는 추세다”라고 한 원장은 말한다. 내신은 1학년 때부터 관리해야하며 공인영어점수는 늦어도 고2 겨울방학 때까지 최고의 점수를 따야한다. 고3에는 영어면접, 에세이, 논술 등을 중점적으로 준비하는 것이 좋다. 대학에 따라 글로벌 전형은 수능 최저 등급을 요구하기 때문에 수능준비도 병행해야하는 어려움이 있다. 도움말 GL에듀 어학원 한승규 원장       (02)538-9552이희수리포터 naheesoo@dreamwiz.comCopyright ⓒThe Naeil News. All rights reserved.• 대통령에게서 멀어지는 여당• 아이폰·넷북·유모차 가격도 관리한다• 국토부, '새만금 통선문 설치 전면 재검토'• [칼럼]국가주권도 못 찾아오는 나라• 새만금 ‘동북아 두바이’ 돼선 안된다• 한명숙 놓고 기로에 선 검찰• 초등생 성폭행 사건 ‘용의자 공개수배’• TV출연 ‘손당구달인’ 알고보니 인질강도범• [INTERVIEW] 사진작가 조선희의 열정• 성매매파문 전 뉴욕주지사 CNN 진행자로 변신[저작권자ⓒ (주)내일신문. 무단 전재-재배포 금지]",https://news.naver.com/main/read.nhn?mode=LSD&mid=sec&sid1=102&oid=086&aid=0002011046
