title,date,press,contents,link
[2011학년도 대입 전략 - 논술전형①] 서울 주요대학，논술로 가장 많은 인원 선발 : 네이버 뉴스,2010.07.02,한경닷컴,"고려대·성균관대·중앙대 등 논술 100% 전형도수시 모집에서 가장 많은 인원을 선발하는 전형은 별도의 지원자격 조건이 없는 일반전형이다． 일반전형은 대개 대학별고사를 실시하며 논술， 면접， 전공적성검사 등 크게 3가지로 유형으로 구분할 수 있다． 그 중 논술고사는 수험생들의 관심이 높은 서울 주요대학은 물론 수도권대학들도 적지않게 실시할 예정이며 대학별로 수시 전체 모집인원의 약 40~50%를， 서강대，한국외대，인하대처럼 수시1，2차 모두 논술전형을 마련한 대학들은 정원의 50%이상을 논술로 선발한다． 특히， 수능이전에 실시하는 수시 1차는 많은 대학들이 수능 최저학력기준을 적용하지 않으므로 수능성적이 부족한 수험생들은 논술 100%전형이나 수능 미반영대학 지원을 적극적으로 검토해보는 것이 좋다．⊙가톨릭대수시 1차 논술우수자전형으로 199명을 모집한다． 재수생까지 지원가능하며 수능최저기준은 간호학과에 한해 적용한다． 논술고사는 통합교과적 논술형으로 출제되는데 비판적 사고력과 창의적 문제해결 능력을 측정할 수 있는 문제가 출제되며， 공통 1문항과 계열별로 2문항씩 총 3문항이 출제된다． ⊙건국대수시 1차 논술우수자전형으로 전체인원의 약 17%에 해당하는 500명을 모집하며 지원자격에 별다른 제약이 없다． 논술고사는 반영비율이 80%로 당락의 절대적인 영향력을 발휘하며 시험은 10월 2~3일에 실시된다． 건국대는 표준점수를 활용하는 다른대학과 달리 수능최저기준을 백분위로 활용하는데 인문계의 경우 수능 2개영역 백분위 86점 이상， 자연계는 백분위 76점이상이어야 한다． ⊙경기대수시1차에서 일반학생전형으로 595명을 선발하며 논술성적과 학생부성적을 각각 50%씩 반영한다． 논술고사는 총 2문항이 출제되는데 인문계의 경우 언어， 사회영역에 중점을 두고 자연계는 수리와 과학교과 관련문항이 출제된다． 시험시간은 2시간이며 답안분량은 문항당 최대 800자 이내이다． ⊙경희대수시1차에서 실시하는 일반학생전형은 우선선발과 일반선발로 구분하여 모집한다． 타대학처럼 우선선발대상자에 대한 별도의 수능 최저기준 없이 논술성적으로만 모집인원의 30%를 선발한다． 나머지 인원은 학생부 25%를 반영하여 최종합격자를 선발하며 계열구분없이 수능 2개영역 2등급을 최저기준으로 적용한다． 올해 논술고사에서 영어제시문이 출제될 수 있다는 점도 유념해두자．⊙광운대지난해부터 논술우수자전형을 실시하고 있는 광운대는 전년도보다 83명을 늘린 286명을 올해 수시 1차에서 선발한다． 학생부와 논술성적을 각각 50%씩 반영하는데 3수생까지 지원가능하며 검정고시출신자는 지원할 수 없다． ⊙국민대올해 논술우수자전형을 신설하였으며 수시 1차에서 130명을 모집한다． 국제학부， 경영학부， 경영정보학부 제외한 전 인문계 모집단위에서만 논술고사를 실시하며 기타 다른 전형요소의 반영없이 논술성적 총점순으로 최종합격자를 선발한다． 수능 2개영역 백분위 85점이상을 최저학력기준으로 적용한다． ⊙고려대수시2차 일반전형의 인원이 전년도 대비 155명 증가하여 전체 모집정원의 약 30%에 달하는 1436명을 모집한다． 우선선발과 일반선발로 구분하여 모집하는데 우선선발은 모집정원의 50%를 논술성적으로만 선발하고 나머지 인원은 학생부 40%와 논술성적 60%를 반영하여 선발한다． 지난 5월 8일에 실시된 모의논술 문제와 해설이 입학처홈페이지에 공지되었으니 고려대 지망자는 반드시 확인해보도록 하자． ⊙단국대올해부터 수시2차모집에 논술우수자전형이 신설되어 378명을 선발한다． 1단계에서 학생성적으로만 모집정원의 8배수를 선발한 후 30%에 해당하는 인원은 논술성적으로만， 나머지인원은 학생부와 논술성적을 합산하여 최종합격자를 뽑는다． 수능이후에 실시되는 수시 2차임에도 불구하고 수능최저기준을 적용하지 않는다． ⊙덕성여대수시 1차 일반학생전형으로 160명을 모집하며 재수생까지 지원할 수 있다． 학생부성적과 논술성적을 일괄합산하여 반영하는데 논술고사는 전년도와 달리 공통논술을 실시하지 않고 계열별로 전공논술을 실시한다． 특히， 약학대학 및 의치학전문대학원 진학에 유리한 교육과정으로 편성되어있는 Pre-Pharm·Med 학과는 수리논술을 실시한다． ⊙동국대수시 1차 일반전형으로 444명을 모집하며 3수생까지 지원가능하다． 모집인원의 30%는 논술성적으로만 선발하며 나머지인원은 학생부 40%와 논술성적 60%를 일괄합산하여 총점순으로 선발한다． 동국대 일반전형 지원자는 학교 홈페이지에 공지된 ‘2011학년도 동국대학교 논술 길라잡이’를 반드시 참조하여 출제유형 및 평가기준을 자세히 숙지하도록 하자． ⊙명지대명지대는 1， 2， 3차 3번에 걸쳐 일반전형을 실시하는데 대학별고사는 모집기간에 따라 각각 전공적성검사， 논술， 면접 등을 실시한다． 수시 2차 일반전형은 학생부와 논술고사를 50%씩 반영하며 서울캠퍼스에서만 220명을 모집한다． 논술고사는 10월 30일(토)에 치러진다． ⊙상명대수시 1차 학생부선택교과우수자전형으로 182명을 선발하며 3수생까지 지원할 수 있다． 1단계에서 학생부성적으로 모집정원의 10배수를 선발한 후 2단계에서 논술고사를 실시하는 단계별전형이다． 논술고사는 인문·자연 통합형으로 출제할 예정이며 시험시간은 90분이 주어진다． 이동훈 생글 대입컨설팅 소장 dhlee@eduhankyung．com<성공을 부르는 습관>ⓒ 한국경제신문, 무단 전재 및 재배포 금지<한국온라인신문협회의 디지털뉴스이용규칙에 따른 저작권을 행사합니다>",https://news.naver.com/main/read.nhn?mode=LSD&mid=sec&sid1=103&oid=015&aid=0002263355
"[2010년 한국인 행복지속가능지수]학생 ‘입시 중압감’ 큰 고3, 65.6점으로 가장 낮아 : 네이버 뉴스",2010.07.05,media KHAN,"ㆍ초 78.5→중 72.3→고 67.3… 대학생 72.1점 소폭 회복ㆍ초등생 “5년 후 더 불행”희망의 동력이 돼야 할 미래가 10대에겐 불행의 근원으로 작용하고 있었다.지속가능사회를 위한 경제연구소(ERISS)가 실시한 초등 4년~고교 3년생들의 행복도는 사실상 입시가 장악하고 있었다.이들에 대한 행복도 조사는 이번이 처음이다. 초등학생(4~6학년)·중학생·고등학생·대학생의 4개 집단별 행복점수는 “젊을수록 행복하다”는 행복학의 통념과 맞지 않았다. 물론 초등학교 고학년 집단에서는 행복점수가 78.5점으로 4개 집단 가운데 가장 높았다. 하지만 고등학생(67.3점) 집단의 점수는 비슷한 연령대의 또래 집단이라고 보기엔 힘들 정도로 대학생 집단(72.1점)에 비해서도 크게 낮았다.중학생 집단(72.3점)은 대학생 집단에 비해 불과 0.2점 높았다. 고등학생은 예상대로 행복점수가 제일 낮았다. 특히 고등학교 3학년생은 65.6점으로 초등학교 4학년~대학교 4학년의 전 학년을 통틀어 최저점을 기록했다. 각급 학교별 행복점수 변화 추이를 살펴보면 초등학교에서 중학교로 올라가면서 가장 큰 폭인 6.2점이 하락했다. 중학교에서 고등학교로 진학하면 다시 5점이 떨어졌다. 초등학생 시절의 행복도는 고등학생이 되면서 11.2점이나 떨어졌지만 대학생이 되면서 회복된 점수는 4.8점에 불과했다.10대의 행복점수는 입시가 가까워질수록 꾸준히 떨어졌다. 초등학교 4학년엔 80점을 넘었지만 5·6학년이 되면서 70점대로 진입했고 중학교 1학년에 진학하자 70점대 전반으로 하락했다. 중학교 2학년에는 점수가 더 떨어져 3학년까지 70점을 갓 넘긴 수준에 머물렀다. 입시의 문턱에 도달한 고등학교에 들어가서는 60점대 후반에 점수가 밀집해 있었다. 고등학교 입학과 함께 대학입시의 중압감에 크게 노출됐다가 2학년 때 잠시 적응한 뒤 3학년에 가장 힘겹게 생활하는 양상이 점수에 그대로 드러났다. 또 고등학교 3년 내내 행복점수가 성인보다 낮게 나타난 현상도 입시지옥의 소묘였다.  그러나 행복지속가능지수(HSI)를 더 분석해 보면 10대에 미치는 입시의 영향은 훨씬 더 컸다. 10대가 대학 입학 시점에 맞춰 불행을 각오하는 모습을 보였기 때문이다. 기존 HSI 조사에 따르면 ‘5년 후 예상 행복점수’는 대학생과 성인집단에서 10점 정도 높게 나온다. 그러나 이번 조사에서 10대 초반부 청소년 세대는 현재보다 미래가 덜 행복할 것으로 예측했다. 초등학교 4학년의 현재 행복점수는 81.9점으로 모든 연령대를 통틀어 가장 높았으나 ‘5년 후 예상 행복점수’는 81.3점으로 현재보다 5년 뒤가 더 불행할 것으로 전망했다. 현재와 미래 간의 행복점수 역전은 초등학교 4학년부터 중학교 1학년까지 나타났다. 딱 5년 뒤 고등학교 3학년이 되는 중학교 1학년의 ‘5년 후 예상 행복점수’(73.6점)가 제일 낮다는 점은 ‘입시올인 세태’가 청소년에게 얼마나 어두운 그림자로 드리워져 있는지를 한눈에 보여준다. 천진난만해야 할 초등학교 4~6학년생이 미래를 현재보다 어둡게 보고 있다는 사실도 기성세대가 눈여겨볼 대목이다. 한준 연세대학교 교수(사회학)는 “고등학생뿐 아니라 10대 초반부터 입시 스트레스를 받고 있는 현상은 우리 미래에 적신호”라며 “이 문제를 해결하려는 사회 전체의 노력이 필요하고, 또한 이른 시일 내에 10대의 스트레스를 경감시켜줄 기성세대의 조치가 필요하다”고 말했다.<안치용 ERISS 소장·김고은·박성철>[관련기사]▶ 한국인 행복지수 추락… ERISS 조사 70점 ‘턱걸이’▶ [2010년 한국인 행복지속가능지수]대학생, 정부 만족도 ‘뚝’ 환경 만족도 ‘쑥’▶ [2010년 한국인 행복지속가능지수]조사 어떻게… 5개 집단 1만6000명 전화·면접▶ [2010년 한국인 행복지속가능지수]행복점수 2년새 1.5점 하락… 男이 女보다 ‘불행’　　- ⓒ 경향신문 & 경향닷컴(www.khan.co.kr), 무단전재 및 재배포 금지〈경향닷컴은 한국온라인신문협회(www.kona.or.kr)의 디지털뉴스이용규칙에 따른 저작권을 행사합니다.〉",https://news.naver.com/main/read.nhn?mode=LSD&mid=sec&sid1=102&oid=032&aid=0002072859
[2011입시 핫클릭](1)EBS 연계율의 진실과 학습전략 : 네이버 뉴스,2010.06.28,media KHAN,"ㆍEBS교재 맹신은 곤란, 기본개념에 충실하자6월의 입시 이슈는 단연 6월 모의평가 뒷 이야기다. 많은 수험생들이 입시전문기관에서 발표하는 원점수 등급 컷에 촉각을 곤두세우고 지원 가능권 대학을 저울질하고 있다. 특히 EBS 교재 및 강의와 연계율에 대한 문의가 입시사이트 및 입시커뮤니티 게시판에 도배 중이다. 앞으로 어떤 학습 전략을 세워야 하는지 관심이 모아지고 있다.이번 6월 모의평가는 한국교육과정평가원에서 발표한 대로 EBS 방송 교재와 강의를 반영한 문항이 눈에 띄게 늘어나 전체적인 난이도에 상당한 영향을 끼쳤다. 평가원은 앞서 EBS가 수능 강의를 위해 사용하는 140여권 중 감수한 115권을 수능과 직접 연계하여 출제하겠다고 발표한 바 있다. 6월 모의평가에서는 이 중 44권의 교재에서 연계돼 문항이 출제됐다.각 영역별로 연계 출제 방식을 보면 이렇다. 언어영역은 글의 소재를 약간 변형하거나(비문학), 교재에 나온 것을 그대로 또는 축소·확대·변형 등 재구성하는 형태(문학)로 반영됐다. 수리영역은 숫자만 바꾸거나 형태를 조금씩 변형하는 경우가 대부분이다. 외국어영역은 지문의 내용을 그대로 활용하고 유형을 바꾼 문항 또는 지문의 내용을 수정해 유형을 바꾼 형식으로 반영됐다. 사회탐구영역은 EBS 방송 교재 자료를 그대로 활용하거나, 자료의 내용을 약간 변형해 구성한 문제들이 출제됐다. 과학탐구영역은 그림·그래프·도표 등 그래픽자료가 일부 변형되거나, 개념·원리가 문제에 그대로 나오는 경우, 교재에서 나온 문제가 축소·확대·결합하는 방식으로 변형되어 출제됐다. 이 같은 모의평가 경향은 난이도의 차이는 있겠지만 본 수능시험까지 이어질 것으로 보인다. 그렇다면 남은 기간 수험생들은 어떻게 학습해야 할까.우선 EBS 방송 교재를 반복적으로 학습해 기본 개념과 핵심 제재와 논지를 반드시 익혀야 한다. 기본 개념과 원리는 EBS 방송 교재뿐 아니라 다른 교재에서도 익히는 것이 가능하다. 그러나 EBS 방송 교재로 공부하는 것이 심리적으로 불안감을 줄일 수 있어 효과적이라고 할 수 있다.또 개인별로 교재를 30권씩 내 것으로 소화하는 것은 힘든 일이다. 따라서 <수능 특강> <고난도 N제> <10주 완성> <파이널 모의고사> 등 주요 교재는 반복해 공부하고 기본 개념과 원리·핵심 제재, 논지를 익혀야 한다. 두 번 정도 반복 학습하다 보면 개념이 내 머릿속에 잡히고 글의 내용을 기억할 수 있다. 교재 속 문제를 출제 가능한 유형으로 변형시켜 보는 것도 좋다. 이 같은 학습이 쌓이면 실력이 되는 것이다.상위권 학생들은 EBS 방송 교재와 연계되지 않는 30% 문항을 반드시 대비해야 한다. 최근 수능 출제 경향은 전반적으로 비교적 쉬운 문제를 지향하면서 상위권을 변별하기 위한 4~5문항이 영역별로 출제되고 있다. 고난도 문제는 반드시 출제되고 이 문제들로 승패가 좌우된다. 시중 교재와 유형 및 형태가 똑같지는 않더라도 한 번 눈에 익은 문제는 난도가 떨어지는 문항이 된다. 따라서 그동안 접하지 못했던 고난도 문제를 풀기 위한 준비를 게을리 해서는 안 된다. EBS 방송 교재만 100% 의존해서는 안 된다는 것이다. ※네이버 지식iN <대학 입시·진학 코너>에 입시 관련 질문을 올려주세요. 채택된 질문은 <2011 입시 핫 클릭!>에 반영됩니다.<유웨이중앙교육 이만기 평가이사>- 대한민국 희망언론! 경향신문, 아이폰 애플리케이션 출시 - ⓒ 경향신문 & 경향닷컴(www.khan.co.kr), 무단전재 및 재배포 금지〈경향닷컴은 한국온라인신문협회(www.kona.or.kr)의 디지털뉴스이용규칙에 따른 저작권을 행사합니다.〉",https://news.naver.com/main/read.nhn?mode=LSD&mid=sec&sid1=102&oid=032&aid=0002071725
올 대입수능 11월18일 : 네이버 뉴스,2010.07.05,강원일보,"원서 접수 후 시험영역·과목 변경 가능 2011학년도 대학수학능력시험은 당초 예고했던 것보다 일주일 늦춰진 11월18일 시행된다.  또 응시원서 접수 후에도 지정된 기간 내에 시험영역과 과목을 변경할 수 있으며 시험 문항의 70%가 EBS 교재 내용과 연계돼 출제된다.  교육과학기술부와 한국교육과정평가원은 이런 내용을 담은 2011학년도 수능 시행 세부계획을 5일자로 공고한다고 4일 밝혔다.  세부계획에 따르면 올해 수능시험은 11월11일 치러질 예정이었으나 우리나라에서 열리는 G20 정상회의 일정과 겹침에 따라 일주일 늦어진 11월18일에 시행된다.  그러나 성적은 예년대로 12월8일까지 통지한다. 원서접수 기간은 8월25일~9월9일 12일간이며 올해부터는 이미 원서를 제출했더라도 지정된 기간(9월7~9일)에 응시영역 및 과목을 변경할 수 있게 된다.  원서 제출 방법은 지난해까지는 수험생이 응시원서 교부처에서 응시원서를 교부받아 직접 수기로 작성해 제출했으나 올해부터는 온라인 접수 프로그램에 원서 내용을 입력하고서 이를 출력해 사진을 붙이고 날인(서명)해 제출하면 된다.  시험 문항 수 대비 EBS 교재와의 연계율은 70%로 높아진다. EBS 교재에 나온 중요 개념·원리, 그림·도표 등을 활용하거나 지문을 재구성하고 문항을 변형하는 방법으로 출제될 예정이다.  황형주기자 victory@kwnews.co.kr",https://news.naver.com/main/read.nhn?mode=LSD&mid=sec&sid1=102&oid=087&aid=0000268426
인천 대입수능성적 전국서 최하위권 : 네이버 뉴스,2010.04.14,연합뉴스,"상위 증가율.하위 감소율은 상위권..2∼3년 뒤 기대    (인천=연합뉴스) 김창선 기자 = 인천지역 2010학년도 대학수학능력시험 성적이 전국 16개 시.도 가운데 최하위권인 것으로 드러났다.    14일 인천시교육청과 한국교육과정평가원에 따르면 2010학년도 수능 성적을 분석한 결과, 인천은 언어와 수리나, 외국어 등 3개 영역에서 상위권인 1,2등급 비율이 전국에서 최하위이고 수리가의 영역만 14위로 간신히 꼴찌를 면한 것으로 집계됐다.    이는 2005∼2009년의 평균 13∼14위권보다 더 떨어진 것이다.    다만 8,9등급 비율은 이들 4개 영역에서 9∼12위로 중하위권이어서 2005∼2009년의 하위권에서 다소 벗어났다.    그럼에도 영역별 평균 표준점수 역시 수리나와 외국어는 가장 낮고 언어는 15위, 수리가는 9위로 나타났다.    이처럼 인천 학생의 성적이 최하위인 것은 최근 몇년 새 급격한 개발로 이동 인구가 많고 지역의 우수 학생들이 가까운 서울지역으로 유출되고 있기 때문인 것으로 분석된다.    특히 교직 사회의 안일한 풍토와 교육에 대한 열정 부족 등이 더 크게 작용하고 있다는 지적도 나오고 있다.    시교육위의 한 위원은 ""인천 교육계 책임자들이 무사안일하다는 얘기가 오래전부터 나왔고, 그 결과가 성적 꼴찌로 나타난 것이다""면서 ""이에 대해 관계자들은 책임져야 한다""라고 주장했다.    다만 2009년도의 성적에 비해 1,2등급의 비율 증가가 수리가의 경우 1위이고 수리나와 언어가 3위, 외국어는 8위인 데다 8.9 등급 감소 비율 역시 2∼6위로 높은 편이어서 앞으로 성적이 향상될 수 있을 것으로 기대되고 있다.    손철수 시교육청 장학사는 ""작년부터 각 등급별로 학생 7명씩의 성적을 끌어올리는 방안을 추진해 상위권이 증가하고 하위권은 감소하는 결과를 얻었다""면서 ""늦어도 2∼3년 안에 전체적으로 성적이 크게 오를 것으로 본다""라고 말했다.    changsun@yna.co.kr<뉴스의 새 시대, 연합뉴스 Live> <모바일 애플리케이션> <포토 매거진><저작권자(c)연합뉴스. 무단전재-재배포금지.>",https://news.naver.com/main/read.nhn?mode=LSD&mid=sec&sid1=102&oid=001&aid=0003223665
"서울대 입시, 고교 한국사 이수하면 가점 : 네이버 뉴스",2010.07.12,서울신문,"[서울신문]서울대학교는 현재 중3 학생이 대학에 입학하는 2014학년도부터 고교 때 한국사 과목을 이수한 응시자에게 가점을 주기로 했다. 또 과학교과 가운데 인문·예체능 계열과 자연 계열은 각각 2, 3과목 이상을 이수해야 지원이 가능하다.서울대 입학관리본부는 2014년부터 인문·자연·예체능 전 계열 응시자에 대해 고교 한국사 과목 이수 여부를 수시 및 정시모집 평가에 반영하겠다고 11일 밝혔다. 한국사를 이수한 학생에게 가점을 주는 방식으로 일선 고교에 한국사 개설을 유도하겠다는 방침이다. 서울대 측은 “각 학교별 교과 선택권이 강화된 ‘2009년 개정 교육과정’ 개편 이후 한국사가 독립교과가 아닌 사회 교과군의 선택사항으로 변경되면서 이같은 방안을 마련했다.”고 설명했다. 2012~2013학년도까지 사회교과군(도덕·역사 포함)은 특정 과목 선택에 상관없이 16~22단위만 이수하면 지원할 수 있다. 김경범 서울대 입학관리본부 교수는 “한국사 과목을 이수하지 않아도 서울대에 지원하는 것은 가능하지만 수시와 정시모집 전형시 한국사 이수 여부가 평가 기준으로 작용한다는 점에서 일선 학교에는 의무규정으로 받아들여질 것”이라고 말했다. 서울대 입시 정책이 교육 현장에 미치는 영향을 감안할 때 대다수 고교가 한국사 과목을 개설할 것으로 보인다.서울대는 또 2014학년부터 물리·화학·생명과학·지구과학 등 과학교과 가운데 인문·예체능 계열 응시생은 2과목, 자연계열은 3과목을 필수로 이수해야 한다. 이 밖에 제2외국어 또는 한문에 대한 기존 4단위의 최소 단위 기준을 없애고 둘 중 한 과목만 이수하면 된다는 조건으로 바꿨다.서울대 측은 “새로운 교과 이수 기준 마련으로 수능 과목 중심의 편협한 공부에서 벗어나 고등학교에서 다양하고 심화된 교육이 이루어질 수 있기를 기대한다.”고 밝혔다.윤샘이나기자 sam@seoul.co.kr     [서울신문 다른기사 보러가기]	      ☞ 아삭아삭 제철과일 까딱하다 어질어질	      ☞ “나 아직 안죽었어”	      ☞ “일기와 한평생… 치매예방에도 좋아”	      ☞ 경제위기 헤쳐 나가고 있는 두바이의 미래는	      ☞ “영포회 정보, 김유환 실장이 野제보”	      ☞ 가계·기업 빚 원금 1700兆 ‘휘청’	      ☞ 車보험 무사고 할인율 5~10%P 확대 검토	      ☞ “나홀로 아동, 성폭력서 보호할 것”	      ☞ [당신들과 우리들의 대한민국] <3> 네팔인 람 찬드라의 ‘자린고비 가계부’	      ☞ [방임 아동·청소년 리포트] <상> 애정결핍, 충동범죄 부른다	      ☞ 兎死狗烹(토사구팽) 유래가…21세기에도 들어맞는 ‘사기’ 명문	      ☞ 단체장들 ‘톡톡’ 튀는 행정 스타일 ‘맛있는 정보! 신선한 뉴스!’ 서울신문(www.seoul.co.kr)[☞ 서울신문 구독신청] [☞ 서울신문 뉴스, 이제 아이폰에서 보세요]- Copyrights ⓒ서울신문사. 무단 전재 및 재배포 금지 -",https://news.naver.com/main/read.nhn?mode=LSD&mid=sec&sid1=102&oid=081&aid=0002097635
