title,date,press,contents,link
[신나는 공부]‘내 수준 파악→입시전략→맞춤 강좌·교재 선택’＝EBS 100%활용! : 네이버 뉴스,2010.04.20,donga.com,"[동아일보] 성적대별 EBS 이용법 《2011학년도 대학수학능력시험을 앞둔 수험생의 관심이 교육방송(EBS)에 집중되고 있다. 교육과학기술부와 한국교육과정평가원(이하 평가원)이 올해 수능 문제 중 70% 이상을 EBS 강좌와 연계해 출제하겠다고 발표했기 때문. 수험생들에게 EBS는 수능 점수 향상을 위해 반드시 통과해야 할 ‘필수 관문’이 된 셈이다. 한국교육과정평가원 대학수학능력시험 연구관리본부 이양락 본부장은 “EBS를 충실하게 본 학생들이라면 올해 수능에 나오는 문제 10문제 중 7문제가 ‘어디선가 본 듯한 문제’로 느껴질 것이다”라고 말했다. 이에 따라 수능을 약 200일 남겨두고 EBS 강좌와 교재를 중심으로 학습방향 및 학습전략을 수정하는 학생들이 적지 않다. 하지만 1000개가 넘는 EBS 강좌와 200권이 넘는 EBS교재 중 자신에게 꼭 맞는 강좌와 교재를 선택하기란 쉽지 않다. 우선 자신의 수준이 어느 정도인지를 파악하고, 그에 따라 입시 전략을 세운 뒤 EBS 강좌와 교재를 활용해야 한다.》 EBS 연계 70% 범위에서도 고난도 문제 출제할 예정 상위권 철저대비를 [수능 1, 2등급 상위권은?] 실수의 원인을 파악하고 ‘고난도 문제’를 공략하라!상위권 학생의 경우 모의고사마다 일정 수준 이상의 점수가 꾸준히 나오기 마련. 하지만 방심은 금물이다. 이런 학생들은 ‘모든 영역에서 만점을 받겠다’는 각오로 수능을 대비해야 한다. 그렇다면 ‘수능 만점’을 방해하는 최대 요소는 뭘까? 바로 ‘실수’다. 상위권 학생들은 자신이 틀린 문제가 어떤 단원에서 나온 문제인지, 어떤 유형의 문제인지 정확히 알고 있지만, 이를 고치기가 쉽지 않다. 수리영역에서 문제를 빨리 풀려다가 사소한 계산 실수를 한다거나, 언어영역에서 지문을 읽으면서 자기 주관을 개입시켜 멋대로 문제를 해석하는 경우가 대표적이다. 우선 오답노트를 활용해 반복된 실수의 원인을 정확히 파악하자. 오답노트를 살펴보며 ‘어떤 유형의 문제를 자주 틀리는지’ ‘어떤 실수를 주로 하는지’에 대해 따로 노트를 마련해 정리하고 실수에 대한 대비책을 함께 써놓는다.실수를 줄였다면 다음 단계로 시험에 나오는 고난도 문제들을 적극 공략해야 한다. 학생들은 EBS와 연계돼 출제되는 문제는 기본적인 수준의 문제이며 나머지 30%에서 고난도 문제가 출제될 것이라고 생각한다. 하지만 이는 큰 오해다. 이 본부장은 “EBS와 연계되는 70%를 제외한 나머지 30%는 고난도 문제의 비율이 아닌 교과서와 EBS 외에 확장된 범위에서 출제되는 문제의 비율을 의미한다”며 “EBS와 연계된 문제 중에서도 고난도의 문제가 출제될 예정이다”라고 밝혔다. EBS를 단계적으로 활용해 고난도 문제를 공략해 보자. EBS 강의와 교재를 ‘수능 특강(개념정리)→10주 완성(개념완성 및 기본 문제)→파이널(수능 문제유형 적응 및 고난도 문제 대비)’ 순으로 학습한다. 이런 과정을 통해 여름방학 전까지는 개념을 견고하게 다지는 데 중점을 두고, 이후엔 고난도 문제풀이에 집중하는 것이 좋다. [수능 3, 4등급 중위권은?] ‘핵심개념’을 익히고 응용문제를 풀어라!수능 3, 4등급인 중위권 학생이 공통적으로 갖고 있는 문제점은 뭘까? 항상 같은 문제를 반복적으로 틀린다는 것이다. 원인은? 문제가 무엇을 묻는지 파악하지 못하기 때문. 이런 학생들 중엔 점수를 올리기 위해 오로지 문제풀이에만 집중하는 ‘실수’를 범하는 경우가 적지 않다. 중요한 것은 지문과 답을 보면서 ‘문제 속 핵심개념’을 찾아내는 것이다. 문제 속 핵심개념을 정확히 파악해야 ‘문제가 무엇을 물어보는지’ ‘문제가 요구하는 답은 어떤 것인지’를 정확히 알 수 있다.EBS를 어떻게 활용하면 핵심개념을 파악하고 문제를 풀 수 있을까? EBS 교재 중 최근 6년간 수능 기출문제를 유형별로 정리한 교재를 선택한다. 그 다음, 하루는 기초 개념을 다시 한번 정리하면서 반드시 알아야 하는 핵심개념을 익히는 데 주력하고, 다음 날은 EBS 교재를 통해 문제를 풀어보는 방식으로 공부하는 것이 도움이 된다. 두산동아 중·고등 편집국 이희자 국장은 “핵심개념을 정리할 때는 개념 완성에 초점을 둔 ‘EBS 개념학습강좌’를 활용하는 것이 효과적이다”라며 “이 강좌에선 EBS 교재가 아닌 다른 출판사 교재들을 활용하기 때문에 좀 더 넓은 출제범위의 학습이 가능하다”고 말했다. 중위권 학생이라면 특히 언어영역과 수리영역을 집중적으로 공부하자. 지난해 수능에서 두 영역 모두 어렵지 않게 출제돼 올해는 시험의 변별력을 위해 고난도의 문제가 추가돼 출제될 것으로 예상된다. 따라서 중위권 수준에 맞춰진 ‘인터넷 수능 시리즈’를 통해 언어영역과 수리영역을 보완하는 것이 좋다. [수능 5등급 이하 하위권은?]‘기초개념’ 익히기에 집중하라!(1)수능이 쉬워졌다고 하는데 여전히 어렵게 느껴진다. (2)책상 앞에 앉아있는 시간은 많지만 점수는 오르지 않는다. (3)틀린 문제를 반복해 틀린다. 하위권 학생들이 공통적으로 겪고 있는 문제다. 원인은 하나, 바로 개념 이해가 부족하기 때문이다. 수능 5등급 이하의 하위권 학생은 문제풀이에 앞서 교과서를 중심으로 각 영역에 나오는 주요 개념을 확실히 익혀야 한다. 그렇다면 EBS는 어떻게 활용할까? 교과서에서 이해가 되지 않는 단원을 따로 표시해 두었다가 EBS 강의나 교재에서 해당 단원만을 골라내 따로 공부한다. 개념이해를 돕는 ‘보충학습용’인 셈. 5월 초까지 기초 개념 익히기에 중점을 두고 5월 중순부터는 6월 한국교육과정평가원 모의고사에 대비해 기초 문제를 풀어봐야 한다. 언어영역에선 짧은 지문을 읽고 푸는 문제, 수리영역에선 난도가 낮은 1, 2번 문제 위주로 문제풀이 연습을 한다. 문제를 풀며 ‘자신이 익힌 개념이 어떻게 문제로 출제되는지’ ‘대표적인 문제 유형은 어떤 것들이 있는지’를 파악한다. 이땐 △단원별 중요 개념 정리 △기출문제 풀이방법을 설명해주는 ‘EBS 인터넷 수능 특강’이 도움이 될 수 있다. EBS 학교교육기획부 유규오 부장은 “수능 특강은 기본 개념을 중심으로 한 강의이기 때문에 하위권 학생들이 개념을 익히기에 적합하다”며 “또 수준별 강의가 이뤄지므로 자신에게 맞는 강의를 선택해 듣는 것이 도움이 된다”고 말했다.  이승태 기자 stlee@donga.com ▼2011학년도 대학수학능력시험, 지난해와 달라진 점은?▼ 1. 시험일자가 늦춰졌다!수능은 매해 11월 둘째 주 목요일에 치러진다. 하지만 올해는 2010 G20 서울 정상회의로 1주일 늦은 11월 18일로 연기됐다.2. 성적표가 빨리 나온다!채점 체제 개선을 통해 채점기간이 단축돼 12월 8일 성적표를 받아 볼 수 있다. 3. EBS 강의·교재와 연계된 문제가 70% 출제된다!‘공교육 내실화와 사교육비 경감’이란 정부 정책에 따라 EBS 수능 방송 교재와 수능 출제의 연계를 70% 수준까지 강화해 출제한다. 자료 출처 한국교육과정평가원 발표 ‘2011학년도 대학수학능력시험 시행기본계획’",https://news.naver.com/main/read.nhn?mode=LSD&mid=sec&sid1=102&oid=020&aid=0002130438
"""입시와 무관한 과외로 해임은 부당"" : 네이버 뉴스",2010.06.23,MBN,서울행정법원은 국립국악학교 교원 박모씨가 과외교습을 했다는 이유로 해임한 것은 부당하다며 교육과학기술부장관을 상대로 낸 소송에서 원고 승소로 판결했습니다. 재판부는 박씨가 과외 교습한 대금 연주는 학생들이 응시 준비를 하던 국악학교의 입시와는 직접 관계없는 과목인 만큼 교원 신분을 박탈할 정도로 중대하지는 않은 것으로 보인다고 밝혔습니다. 1993년부터 국립국악학교 교사로 근무해온 박씨는 2006년부터 2007년 6월까지 대금 연주법을 과외 교습한 혐의로 지난해 5월 해임됐었습니다.[MBN리치 전문가방송 - 순도100% 황금종목 발굴]< Copyright ⓒ mbn(mbn.co.kr). 무단전재 및 재배포 금지 >,https://news.naver.com/main/read.nhn?mode=LSD&mid=sec&sid1=102&oid=019&aid=0002111615
2011 수능 전망과 대학입시 성공 전략! : 네이버 뉴스,2010.06.19,뉴시스,【서울=뉴시스】최별 기자 = 19일 오후 서울 한양대학교에서 열린'EBS 입시설명회'에서 학부모 및 고3 수험생들이 참석해 대학입시 성공 전략에 관한 설명을 듣고 있다.  photo@newsis.com,https://news.naver.com/main/read.nhn?mode=LSD&mid=sec&sid1=102&oid=003&aid=0003299122
"""대입 수시 논술 영향력 커졌다"" : 네이버 뉴스",2010.05.06,MoneyToday,"[머니투데이 최중혁 기자][정시는 수능 언수외 비중 확대]  2011학년도 대학입시에서 수시모집은 논술의 비중이, 정시모집은 수능 언·수·외 영역의 비중이 전년보다 커져 이에 대한 대비가 필요하다는 분석이 나왔다.  6일 대입전문기관인 이투스청솔 평가연구소(소장 오종운)에 따르면 연세대는 올해 수시1차 일반우수자 전형의 우선선발 비율을 지난해 60%에서 올해 70%로 올렸다. 일반우수자 전형의 우선선발은 논술 80%, 학생부 20%를 각각 반영해 뽑는데 이 비율이 높아지면 논술의 실질적인 영향력도 커진 것으로 볼 수 있다.  성균관대 또한 수시2차 일반전형에서 우선선발의 경우 논술 100%로 뽑고, 일반선발의 논술 반영 비율도 지난해 60%에서 올해 70%로 높였다. 이화여대도 논술 중심으로 뽑는 수시1차 일반전형에서 상위 60%의 합격자에 대해 수능 최저학력기준을 적용하지 않아 논술의 영향력이 커졌다.  정시모집에서는 탐구 영역 비중이 줄어든 것이 특징적이다. 연세대, 고려대를 비롯해 건국대, 경희대, 동국대, 서강대, 서울시립대, 성균관대, 이화여대, 중앙대, 한국외대, 한양대 등 수도권 주요 대학들이 수능 탐구 영역 반영 과목 수를 기존 3과목에서 2과목을 줄였다.  이에 따라 인문계열의 경우 성균관대, 한양대의 언어(30%), 수리(30%), 외국어(30%) 영역 반영비율이 90%인 반면, 탐구영역 반영 비율은 10%에 불과한 것으로 나타났다.  오종운 소장은 ""주요 대학별로 수시 전형에서는 논술고사의 영향력이 더욱 높아졌고, 정시 전형에서는 수능 언수외 반영 비중이 높아졌다""며 ""수시는 논술고사, 적성고사, 면접 등 대학별고사에, 정시는 수능 언수외 영역에 집중적으로 대비하는 것이 좋다""고 말했다.  2011학년도 수시 원서접수는 9월 8일부터 13일까지 진행되며, 논술시험은 1차의 경우 10월초에, 2차는 11월말에 대부분 치른다. [관련기사]☞  연세대 ""대입 자율화되면 대학별 고사 도입""☞  ""내년 대입부터 수시 추가모집 가능""☞  교과부, 대입 공동원서제 추진  ▶ (머니마켓) 오늘의 증권정보 '재야고수 종목 엿보기' ▶ (머니마켓) 테마주 성공투자 '프로페셔널 포트폴리오' ▶ (머니마켓) 성공투자의 지름길 '오늘의 추천주'   최중혁기자 tantan@ <저작권자 ⓒ '돈이 보이는 리얼타임 뉴스' 머니투데이, 무단전재 및 재배포 금지>",https://news.naver.com/main/read.nhn?mode=LSD&mid=sec&sid1=101&oid=008&aid=0002325965
"유황우 언어논술, '2011 대입 수시 논술 공략 포인트' : 네이버 뉴스",2010.05.25,뉴시스,"【서울=뉴시스헬스/뉴시스】 수시전형 모집인원 확대 분위기 속에서 수험생들이 수시 준비에 돌입하면서 '논술'에 대한 관심이 그 어느 때보다 높다. 올해 대학입시 수시모집 특징 중 하나인 '논술 영향력 강화' 때문이다. 논술이 수시모집의 핵심이 될 정도로 각 대학이 논술에 주목하고 있는 것이다. 올해 대입선발 인원 중 수시모집으로 선발하게 될 인원은 약 23만 명으로 전체 60% 정도이며, 이 중에서 논술을 통해 입학생을 선발할 비율은 대학 평균 50% 이상이나 된다. 수시에서 합격의 당락을 결정짓는 중요한 열쇠가 '논술'이라 해도 과언이 아니다. 25일 유황우 언어논술의 유황우 대표에 따르면 서울 내 상위권 대학 중 30여 개 대학이 논술을 보고, 더욱이 일부는 논술만으로 합격여부를 결정 지을 수 있을 정도로 수시에서 논술의 중요성이 높아졌다며 수시전형 성공을 위한 체계적이고 철저한 논술 준비가 필요하다고 밝혔다. 2011학년 성공대입을 위한 논술 공략을 위해 대학들의 논술 출제 방향과 준비 전략 등을 유황우 대표와 함께 알아봤다. ◇희망대학 논술 전형 체크, '기간 나눠 논술 준비해야' 주요 대학들이 수시모집에서 많은 인원을 논술고사를 통해 선발한다. 특히 상위권 대학들 목표로 삼고 있는 수험생들에게 논술은 수능준비만큼이나 꾸준히 준비해야 하는 기본적인 것이 된다. 먼저 자신이 원하는 대학의 논술 출제 유형 및 계열별 특징을 확인하고, 이에 대비한 준비를 시작해야 한다. 논술고사 일정, 문항 수, 시험시간, 출제 성격, 논술 선발 비율 등 희망 대학 논술 전형에 대한 파악은 기본이다. 또 5~11월 기간을 나눠 체계적으로 논술시험에 적응하는 것도 좋다. 현재 본인의 논술 실력이 어느 정도인지 확인하고, 실력을 높일 수 있는 문제 유형을 접하는 것이 유리하다. 이 때 반복되는 실수 및 취약점을 확인하고 개선해야 함도 필요하다. 실제 논술고사를 앞두고서는 실전 같은 모의논술을 치러봐야 한다. ◇인문계, 각 대학별 특성 고려한 논제 파악해야 인문계의 경우 대학별 특성을 가진 문제 유형을 선보이고 있다는 점을 파악한 후 자신이 지원하는 대학 유형에 맞춰 논술시험을 준비해야 한다. 각 대학 개성에 맞는 논술 유형을 바탕으로 사회, 경제, 수리, 인문, 과학 등을 통합한 논술 문제가 출제 되고 있으므로, 단순히 글을 잘 쓰는 것 보다 논물 문제에 대한 이해와 통합적 사고력이 뒷받침 될 수 있도록 학습이 필요하다. 다수 대학들의 문제 출제 유형의 공통점은 수리 및 논리적 사고를 필요로 한다는 점이다. 이와 관련해 텍스트, 그래프, 그림, 도표 등 자료에 대한 해석 및 활용을 요구하는 다양한 형태의 문제 유형들도 많아지고 있다. 영어 제시문을 활용하는 대학도 있음을 체크해 두는 것이 좋다. ◇통합형 논술 제시, 문제 해결과정 서술이 중요 자연계 논술은 통합형으로 출제되고 있는 분위기다. 수리ㆍ과학 통합형, 과학형, 인문ㆍ수리 통합형으로 나눠지는데, 기본 성격이 수학, 과학, 물리 등의 각 과목들과의 연계를 통해야 이해할 수 있는 문제들이 대부분이다. 이 때문에 통합교과형 문항에 대비해야 하는 것이다. 알아둬야 할 것은 논술문제의 정확한 답을 알아내는 것 보다는 해결 과정을 서술하고 그것을 평가하는 것이 자연계 논술의 특징이라는 점이다. 또 대부분의 학교가 기존 교과과정에서 배운 것을 바탕으로 활용할 수 있도록 출제하고 있지만 단순히 암기한 내용만으로는 문제를 해결하기에는 역부족이다. 따라서 교과과정에서 다루고 있는 기본적인 개념과 원리를 정확하게 이해하는 노력이 필요하다. ◇논술 영향력 높더라도 수능과 별개 생각은 금물 최근 출제 경향을 보면 논술과 수능의 관계가 점점 좁혀지고 있다. '수능이 우선, 논술은 선택'이라는 인식이 허물어지고 있는 것이다. 수시 전형에서 논술 비율이 높아져 가고 있는 상황만 보더라도 이 점은 명백하다. 하지만 이러한 분위기로 인해서 수능과 논술 어느 하나에만 치우쳐 준비하는 것은 금물이다. 두 가지 모두를 하나의 대입 관문이라고 생각하고, 적절히 시간을 안배해 학습해야 할 것이다. 물론 쉽지 않지만 그래야 하는 것이 성공 대입의 포인트다. <도움말 : 유황우 언어논술 대표>조진성기자 jingls29@newsishealth.com<관련사진있음>유황우 언어논술, '2011 대입 수시 논술 공략 포인트'",https://news.naver.com/main/read.nhn?mode=LSD&mid=sec&sid1=103&oid=003&aid=0003256917
"비상에듀 입시평가실, 6월 모의평가 대비와 활용법 소개 : 네이버 뉴스",2010.05.21,아시아경제신문,"[아시아경제 김도형 기자]대입 수험생들의 6월 모의평가(6월10일 시행)가 20여일 앞으로 다가왔다. 6월 모의평가는 실제 수능 시험을 출제하는 한국교육과정평가원의 시험이다. 3월과 4월 전국연합학력평가를 치른 재학생들은 이번 입시에서 함께 경쟁할 졸업생들과 실력을 견줘보면서 전국단위 수험생 중에서 자신의 위치를 확인할 수 있는 첫 기회이기도 하다.특히, 올 수능시험의 전체 난이도와 신경향 출제, EBS와의 연계성 등 전반적인 출제 경향도 알아볼 수 있는 시험이다. 비상교육의 대입브랜드 비상에듀 이치우 입시평가 실장은 6월 모의평가가 본수능보다 다소 어려울 것으로 예상하면서 실제 수능 대비를 위한 영역별 학습에 대한 선택과 집중 결정 시기로 활용할 것을 권했다.◆ 난이도, 실제 수능보다 다소 높아 = 비상에듀 입시평가실에 따르면 6월 모의평가는 수능보다 다소 어렵게 출제되는 경향이 있다. 특히 수리영역이 상대적으로 더 어렵다. 사탐, 과탐은 어려운 과목과 쉬운 과목이 섞여 있지만, 전체 난이도는 역시 실제 수능에 비해 높다는 평가다. 이치우 실장은 “이번 6월 모의평가는 지난해 6월 시험과 난이도가 비슷할 것”이라면서도 “EBS 교재에서 50% 가량 출제하겠다는 방침에 따라 수험생들이 느끼는 체감 난이도는 낮아질 가능성도 있다”고 예상했다. 그는 “전체 난이도 균형을 맞추기 위한 고난도 문항도 일부 등장할 것”이라고 전했다. ◆ 탐구영역 학습, 본격적으로 시작할 때 = 비상에듀 측은 이번 모의평가를 계기로 수능 영역 및 과목에 대한 ‘선택과 집중’하는 전략을 쓸 필요가 있다고 설명했다. 언어, 수리, 외국어영역 위주로 공부해오던 이전의 학습 비중을 조정할 시기라는 것이다. 그동안 미뤄왔던 탐구영역 학습을 시작하면서 언어·수학·외국어 영역은 희망대학의 영역별 반영비율과 자신의 영역별 강약에 맞춰 조정한다. 특히 탐구과목은 자신이 선호하는 1~2과목을 선택해 여름 방학이전부터 시작해야 한다. 특히, 주요 대학들은 올해 입시에서 탐구과목수를 2과목으로 낮추고, 반영 비율을 줄이는 추세다. 탐구에 대한 부담은 덜었지만, 1문제라도 실수할 경우 이 과목에서 상대적으로 손해 볼 가능성이 있다. 이 실장은 “탐구 과목에서 변별력이 줄어들면 언·수·외 등 주요 영역에서 수능 성적의 변별력이 커질 가능성도 높다는 사실을 간과해서는 안된다”고 강조했다. ◆ 영역별 강약에 따른 학습시간 배분 고민해야 = 수험생들이 수능까지 남은 150여 일 동안 끌어 올릴 수 있는 점수는 얼마나 될까. 비상에듀 입시평가실 측은 작년 ‘6월 학력평갗에서 영역별 원점수 80점을 받은 경우 수능시험에서 언어 5점, 수리(가/나) 4점, 외국어 5점 정도의 향상이 가능했다고 밝혔다. 4~5점 상승이라면 1~2문항을 더 맞춘 것. 그러나 영역별 향상 점수를 모두 합산한 총점은 진학 가능 대학의 수준을 1~2단계 올릴 수 있을 만큼 크다. 수험생이라면 누구나 성적 향상을 기대한다. 하지만 반대로 성적이 하락하는 비율도 절반 가까이 된다. 이 실장은 “6월 모의평가 이후에는 자신의 영역별 강약에 따른 전략적인 학습시간 배분이 중요하다는 교훈을 얻을 수 있다”고 해석했다.[아시아경제 증권방송] - 무료로 종목 상담 받아보세요김도형 기자 kuerten@<ⓒ세계를 보는 창 경제를 보는 눈, 아시아경제(www.asiae.co.kr) 무단전재 배포금지>",https://news.naver.com/main/read.nhn?mode=LSD&mid=sec&sid1=102&oid=277&aid=0002379481
中 대학입시 보면 세태 보인다? : 네이버 뉴스,2010.06.08,헤럴드경제,"올해 원자바오 詩 출제꿈위해 고난 극복 당부［베이징=박영서 특파원］ 중국 대입시험인 ‘가오카오(高考)’가 중국 전역에서 957만명이 지원한 가운데 7일부터 전국 26개 성ㆍ시에서 일제히 시작됐다. 올해에도 작문 제목은 가장 관심을 끌었다. 많은 지역에서 중국의 사회상과 세태, 핫이슈를 반영한 작문시험이 출제돼 수험생들의 사고 능력과 작문 실력을 평가했다. 지난 7일 치러진 작문시험에서 가장 화제를 모은 제목은 베이징 지역의 ‘앙망성공 각답실지(仰望星空 脚踏實地)’다. ‘원대한 꿈을 가지고 성실하고 진지하게 앞으로 나아가야 한다’는 뜻이다.특히 ‘앙망성공(별 밤을 바라보다)’은 바로 원자바오(溫家寶) 총리의 시다. 지난 2007년 9월 원 총리는 장시(江西)성 우닝 현을 시찰하면서 이 시를 지었다. 그는 밤중에 지역을 시찰하면서 ‘별이 가득한 하늘을 바라본다… 나로 하여금 고통스럽게 모색하게 하고 뒤따르도록 하네’라는 한시를 읊었다. 이 시는 이상(理想)을 추구하기 위해 현실의 어려움을 극복해야 한다는 메시지를 담고 있다. 후에 이 시는 런민르바오(人民日報)에 정식 발표됐고, 올해 5월에는 베이징항공우주대학이 새로 정한 교가의 가사가 되기도 했다. 베이징 시 입시 관계자는 “ ‘앙망성공, 각답실지’ 8자에는 청년 학생들에게는 원대한 꿈이 있어야 하고 어려움 속에서도 이를 실천해나가야 한다는 바람이 담겨 있다”고 분석했다. 이와 함께 허난(河南)성 입시 작문은 만화 작문이어서 이채를 띠었다. 여러 마리의 고양이가 밥상 위의 물고기를 먹고 있는데 단 한 마리만이 쥐를 잡고 있다. 다른 고양이가 말한다. “먹을 물고기가 있는데 왜 쥐를 잡는가.” 이 작문은 현재 중국 사회가 안고 있는 문제점을 꼬집는 것으로, 사회성이 담겨 있다.이 밖에도 장쑤(江蘇)성은 최근 화두가 되고 있는 친환경사회를 반영한 ‘녹색생활(綠色生活)’ 등 작문시험을 출제해 관심을 모았다.pys@heraldm.com  - 헤럴드 생생뉴스 Copyrights ⓒ 헤럴드경제 & heraldbiz.com, 무단 전재 및 재배포 금지 -",https://news.naver.com/main/read.nhn?mode=LSD&mid=sec&sid1=102&oid=016&aid=0000347469
