title,date,press,contents,link
"""취약부분 확인하고 입시전략 세워라"" : 네이버 뉴스",2010.06.02,서울경제,"'작은 수능' 6월 모의평가 일주일 앞으로…수능 출제방향 가늠할 수 있어 결과 토대로 학습비중 조정을'작은 수능'이라 불리는 6월 모의평가(6월10일)가 일주일 앞으로 다가왔다. 특히 졸업생과 재학생이 함께 치르는 시험인 만큼 수험생들로서는 전국단위의 전체 수험생 중에서 자신의 위치를 파악할 수 있는 첫 기회이기도 하다. 김희동 진학사 입시분석실장은 ""이번 모의평가로 취약 부분을 확인하고 대입 전략을 세워야 한다""고 말했다. ◇재학생ㆍ졸업생이 함께 치르는 첫 시험=6월 모의평가는 수능 출제 방향을 알 수 있는 시험이다. 수능을 주관하는 평가원에서 출제하기 때문에 실제 수능과의 연관성도 높다. 또 6월 모의평가로 올해 수능의 출제 방향, 난이도 등이 결정되기 때문에 올해 수능시험을 점칠 수 있는 중요한 기준이 된다. 특히 이미 두 차례 실시한 교육청 학력평가와 달리 6월 모의평가는 졸업생도 응시하기 때문에 수험생의 위치를 객관적으로 알 수 있다. 다만 실제 수능에서는 졸업생이 더 늘어난다는 점을 감안해야 한다. 객관적 위치를 판단할 수 있는 시험인 만큼 지원 가능 대학의 범위를 정하고 수시냐, 정시냐의 지원전략을 세운 뒤 그에 따른 맞춤 학습을 해야 한다. 3월과 4월 두 차례 학력평가로 드러난 자신의 취약점 역시 최종 점검해 이 부분에 대한 집중학습 성과가 6월 모의평가에서 나타날 수 있도록 하는 것도 중요하다. 또 실제 수능과 가장 유사한 형태로 실시되는 시험인 만큼 지금까지 학습하는 데만 중점을 뒀다면 이제부터는 학습 외적인 부분, 즉 시간관리나 마인드 컨트롤 등에 대한 신경도 써야 한다. ◇영역별 점검에 의미 둬야=6월 모의평가 시험 결과가 나오면 이를 토대로 수능영역 및 과목에 대한 선택과 집중을 해야 한다. 언어ㆍ수리ㆍ외국어영역 위주로 공부해오던 이전의 학습 비중을 조정할 시기인 것. 그동안 미뤄왔던 탐구영역 학습을 시작하면서 언ㆍ수ㆍ외영역은 희망대학의 영역별 반영비율과 자신의 영역별 강약에 맞춰 조정해야 된다. 특히 탐구과목은 자신이 선호하는 1~2과목을 선택해 여름방학 이전부터 시작해야 한다.  ◇수시지원 여부 결정의 판단 자료=6월 모의평가가 수험생들에게 중요한 이유 중 하나가 바로 수시지원 여부 때문이다. 모의평가 성적이 학생부에 비해 월등히 우수한 학생은 정시에 비중을 두고 수능 준비에 몰두하는 것이 좋다. 반면 모의고사 성적이 제대로 나오지 않아서 학생부 성적에 비해 많이 떨어질 때는 수시를 적극적으로 공략해야 한다. 장학수 스카이에듀 입시분석실장은 ""수시1차 합격자는 정시지원이 불가능하기 때문에 지원 여부를 신중하게 고려해야 할 것""이라고 조언했다. 한편 이치우 비상에듀 입시평가실 실장은 ""이번 6월 모의평가는 지난해 6월 시험과 난이도가 비슷할 것""이라면서도 ""EBS 교재에서 50%가량 출제하겠다는 방침에 따라 수험생들의 체감 난이도는 낮아질 가능성도 있다""고 예상했다.  송주희기자 ssong@sed.co.kr ▶[알파클럽] 재야고수 추천! 오늘의 승부주는? [ⓒ 인터넷한국일보(www.hankooki.com), 무단 전재 및 재배포 금지]송주희",https://news.naver.com/main/read.nhn?mode=LSD&mid=sec&sid1=102&oid=011&aid=0002069121
현직교사에게 ‘대입 맞춤전략’ 들어보세요 : 네이버 뉴스,2010.05.09,The Internet Hankyoreh,"[한겨레]  대입 수시 지원이 다가오면서 맞춤지원 전략에 관심 있는 고3 학부모들에게 진학 경험이 풍부한 현장교사가 고민을 해결해주는 특강이 열린다. 한겨레교육문화센터는 신촌센터(hanter21.co.kr)에서 오는 28일과 29일 이틀에 걸쳐 대입 맞춤전략 특강과 워크숍을 진행한다. 수시 모집 정원이 60%를 넘어서고 논술·학생부·영어성적 등 다양한 전형자료를 활용하고 있는데, 현직 교사가 수험생에게 가장 유리한 조건으로 선발하는 대학을 찾는 방법을 알려준다. 수강료는 특강 4만원, 워크숍까지 참가할 경우 10만원이다. 분당센터(hanedu21.co.kr)에서도 같은 강좌가 진행된다. 참가비는 8만원. 정원이 20명으로 제한되어 있어 선착순으로 마감한다. 고2 학부모들도 참가가 가능하다. 문의 신촌 (02)3279-0900, 분당 (031)8018-0900. 이란 기자  세상을 보는 정직한 눈 <한겨레>  [한겨레신문 구독 | 한겨레21 구독]공식 SNS 계정: 트위터 www.twitter.com/hanitweet / 미투데이 http://me2day.net/hankyorehⓒ 한겨레신문사, 무단전재 및 재배포 금지<한겨레는 한국온라인신문협회(www.kona.or.kr)의 디지털뉴스이용규칙에 따른 저작권을 행사합니다.>",https://news.naver.com/main/read.nhn?mode=LSD&mid=sec&sid1=102&oid=028&aid=0002042714
대입 이중등록자 2700명…합격취소 대신 '쉬쉬' : 네이버 뉴스,2010.05.08,SBS & SBSi ,"동영상 뉴스       <앵커> 대학 수시와 정시모집에 이중 합격하고도 입학이 취소되지 않은 불법 입학생이 지난 2년간 2,700명에 이르는 것으로 확인됐습니다. 대학 입시의 원칙을 무너뜨리는 심각한 부정행위인데, 교육당국은 면죄부를 주는데만 급급했습니다.최우철 기자의 단독보도입니다. <기자>SBS가 입수한 전국 대학의 2008년과 지난해 '이중등록위반자 현황자료'입니다. 수시와 정시모집에 동시에 합격해 이중등록을 한 학생이 2,700명이나 됩니다. 동국대와 고려대 등 주요 사립대를 포함한 4년제 대학 100곳 이상이 해마다 많게는 20명까지 이중등록자를 입학시켰습니다. 고등교육법에는 수시에 합격한 학생은 정시에 지원 자체를 못하게 하고 있습니다. 이를 어기고 이중등록한 학생은 대학교육협의회의 심의를 거쳐 각 대학에 입학취소를 통보해야 합니다. 일부 우수 학생들이 진학의 기회를 독점하지 못하도록 하기 위한 겁니다. 하지만, 실제로 입학이 취소된 학생은 전체 3% 수준인 70여 명에 불과합니다. 심의위원회가 학부모나 교사가 한 것일 뿐 학생이 고의로 이중등록한 게 아니라는 소명서만 받고, 구제해줬기 때문입니다. [전직 입학취소 심의위원장 : 대체로 학생들 입장에서 이해를 해줘요. 위원회에서 '구제를 해도 되겠다 아니다'라는 합의를 보거든요. (취소자가) 별로 없더라고요.]일부 대학은 구제받는 법을 가르쳐 주기도 합니다. [00 사립대 입학처 관계자 : 지금까지는 소명서로 통과가 됐었는데… 저희 학교 수시합격하시고, 정시에 다른 학교 가신 거죠? 해당 학교에 문의를 하셔서 소명서를 꼭 쓰도록하십시오.] 일부 학생과 교육당국이 입시의 룰을 깨는 사이, 법을 지킨 학생들만 응시기회에 차별을 받은 셈입니다. 최우철 justrue1@sbs.co.kr관/련/정/보◆ 중고생 5명중 1명 '우울·자살생각 위험군'◆ ""한국 어린이·청소년 '삶 만족도' OECD 꼴찌""◆ ""입학사정관제 EBS 실효성 떨어져""◆ 수능 지역차 여전…평준화 논쟁 재연될까◆ 대세로 자리 잡은 학교 수능 성적 공개[SBS기자들의 생생한 취재현장 뒷이야기 '취재파일']저작권자 SBS&SBS;콘텐츠허브 무단복제-재배포 금지",https://news.naver.com/main/read.nhn?mode=LSD&mid=sec&sid1=102&oid=055&aid=0000181986
[2011학년도 대입 전략 - 한양대] 수시 일반우수자전형，논술로 당락 갈려 : 네이버 뉴스,2010.05.07,한경닷컴,"작년 내신 합격권 80~90%가 논술 때문에 불합격한양대는 지난 3월 2011학년도 입학전형계획안을 발표하였다.수능 이전에 실시하는 수시 1차 6개 전형 모집은 학생부，특기자 중심으로 692명의 신입생을 선발할 예정이며，수시 2차 4개 전형 모집은 논술전형 중심으로 1240명，정시모집은 '가'군의 수능우선선발제와 '나'군 수능 100%로 선발하는 등 수능 중심으로 1174명을 모집할 계획이다.올해 입학사정관제는 총 715명으로 모집인원이 증가하였고，수시 1차 대부분의 전형과 정원외 특별전형 등을 모두 입학사정관 전형으로 선발할 계획이다.한양대를 지망하는 수험생들은 모집시기에 따른 전형의 특성을 파악하고，좀 더 세부적으로 각각의 전형에서 전형요소가 지닌 영향력을 따져본 후 자신에게 가장 유리한 전형을 공략하는 것이 좋다.또한 지난해 수시모집에서 수능 최저학력기준에 미달되어 최종 불합격 처리된 인원이 적지 않았으므로 각 전형별 수능 최저학력기준 및 우선선발 조건을 지원 전에 자세히 확인해 봐야 한다.한양대 입학전형의 주요특징들을 정리해 보면 △수시 입학사정관제 증가 △수시 일반우수자전형 우선선발 확대 △정시 수능 영역별 반영비율 변경 등으로 정리할 수 있다.⊙ 학업우수자전형 평균등급 1.2~1.4가 지원권수시 1차에서 240명을 모집하는 학업우수자전형은 1단계에서 교과성적으로 일정배수를 선발한 후 2단계에서 학생부 비교과로 최종합격자를 선발한다.수능최저학력기준은 계열 구분없이 수능 2개 영역 2등급 이내이지만，특성화학과인 정책과학대학 정책학과와 경영대학 파이낸스 경영학과는 수능 언수외 합이 4등급 이내로 매우 높다.1단계에서 교과성적만으로 전형하기 때문에 1단계 통과자들의 교과성적이 매우 높은 편이다.지난해 학업우수자전형 합격자들의 평균 교과 등급이 인문계는 1.31，상경계열은 1.23，자연계는 1.29였다.하지만 1단계 통과자 중 약 45%에 해당하는 인원이 수능 최저학력기준 미달로 최종 합격자에 포함되지 못했다.따라서 학생부 성적이 우수하더라도 평가원 모의고사 성적이 수능 최저학력기준에 미치지 못한다면 지원시 신중을 기해야 한다.⊙ 수시 특별전형，지원자격 조건 꼼꼼히 살펴봐야한양우수과학인전형과 공학인재전형은 각각 140명을 모집하는데 과학고 출신 학생이나 수리과학 분야에서 우수한 성적을 받았거나 탁월한 능력을 증명할 수 있는 수험생들이 지원할 수 있다.두 전형 모두 전형방법은 비슷하나 한양우수과학인전형은 논술고사로 수리사고력 능력을 평가하고 수능최저학력기준이 없다.반면 공학인재전형은 학생부(교과+비교과)성적만 반영하지만 수능 최저학력기준이 적용된다는 점에 유의하자.45명을 모집하는 국제학부전형은 1단계에서 공인어학성적으로 일정배수를 선발하는데 TOEFL IBT 105점，TEPS 870점，TOEIC 940점 이상이 되어야 지원 가능하다.2단계에서 실시되는 면접은 평가영역을 말하기와 쓰기로 구분하여 약 40분 내외로 실시된다.미래인재전형은 타대학들의 자기추천전형과 유사하며 학업성적이 우수하고 특정 분야에서 탁월한 재능을 지니고 있어야한다.1단계에서 서류평가를 실시하고 2단계 면접，3단계 입학사정관 심의평가위원회의 종합평가를 거쳐 최대 60명을 선발한다.⊙ 일반우수자 우선선발 인원 50% → 60% 확대수시에서 950명으로 가장 많은 인원을 선발하는 일반우수자전형은 논술중심전형으로 우선선발과 일반선발로 구분하여 신입생을 모집한다.우선선발 조건은 인문계의 경우 수능 언수외 합이 4등급 이내여야하며，자연계는 수리 외국어 과탐영역 등 3개영역의 합이 4등급 이내여야 한다.단，정책학과와 파이낸스 경영학과는 수능 언수외 모두 1등급으로 조건이 매우 까다롭다.우선선발과 일반선발의 논술반영비율이 각각 80%，60%로 논술이 당락을 결정하는데 절대적인 영향력을 발휘한다.한양대 논술고사에서 고득점을 얻기 위해서는，첫째 논제가 요구하는 내용과 조건을 확실히 충족시키고，둘째 주어진 지문의 주제를 분명히 정리한 후，셋째 지문내용의 상호관계를 파악하여 자신의 주장 또는 설명에 응용해야한다.따라서 한양대 일반우수자전형을 지원하는 수험생들은 입학처 홈페이지(http;//www.hanyang.ac.kr)를 방문해서 올해 수시 2차 모의논술자료를 참고하여 출제의도，평가지침，예시답안 등 논술관련 내용을 꼼꼼히 살펴봐야 한다.올해부터 우선선발 모집비율이 지난해 50%에서 60%로 확대되었는데 지난해 학생부성적으로 합격권에 준하는 점수를 받은 약 80~90% 인원이 논술로 당락이 뒤바뀐 점을 명심하도록 하자.⊙ 글로벌한양전형도 논술성적이 당락 좌우수시 2차에서 150명을 모집하는 글로벌한양전형은 인문계는 국어와 영어교과，자연계는 수학과 과학교과 중 각 교과별 상위 3개 과목으로 평균 등급이 2.5등급 이내이거나 외국어에 관한 전문교과가 15단위 이상이여야 지원 가능하다.또한 영어는 TOEFL IBT 100점, TOEIC 900점, TEPS 800점，중국어 HSK는 9급이상，독일어는 ZD 또는 ZMP를 취득해야 한다.수능최저학력기준은 적용되지 않지만 논술성적이 60% 반영되므로 글로벌한양전형을 지원하는 수험생은 한양대 논술유형에 맞게 꾸준히 준비해야한다.사랑의 실천전형은 국민기초생활보장수급자 가정이나 국가유공자 자녀 및 사회기여자 자녀가 지원할 수 있다.학생부 30%，서류 10%，논술성적 60%를 일괄 합산하여 반영하고 수능 최저학력기준이 적용된다.⊙ 정시 인문 · 상경계열 수능반영비율 변경정시에서는 '가'군과 '나'군으로 분할모집을 실시한다.가군에서는 우선선발과 일반선발로 나뉘어 모집하는데 모집정원의 70%를 수능성적으로만 선발하며 나머지 인원은 학생부와 수능성적을 합산하여 총점순으로 합격자를 뽑는다.탐구영역은 상위 2개 과목만 반영하지만 3개 과목이상을 필수적으로 응시해야 한다.'나'군에서는 수능 100%를 반영하여 선발하며，인문계열과 상경계열에 한해 제2외국어/한문영역을 사회탐구 영역의 한 과목으로 대체할 수 있다.자연계에서는 과탐Ⅱ 과목에 가산점을 부여한다.정시에서 눈여겨봐야 할 점은 인문상경계열의 수능반영비율 변경이다.자연계는 전년도와 마찬가지로 언어 20%，수리 30%，외국어 20%，탐구 30%를 반영하지만 인문 · 상경계열은 올해부터 연세대와 고려대처럼 언수외 각각 모두 30% 반영하고，탐구영역은 10% 반영으로 변경되었다.이동훈 생글 대입컨설팅 소장 dhlee@eduhankyung.com<성공을 부르는 습관>ⓒ 한국경제신문, 무단 전재 및 재배포 금지<한국온라인신문협회의 디지털뉴스이용규칙에 따른 저작권을 행사합니다>",https://news.naver.com/main/read.nhn?mode=LSD&mid=sec&sid1=103&oid=015&aid=0002235862
[Prime TOWN]달라진 자율고 입시 어떻게 준비할까 : 네이버 뉴스,2010.05.17,donga.com,"[동아일보] 주요5개 교과 성적 내신 4% 유지꾸준한 봉사-독서활동 잊지말길 2011학년도 고교입시에선 자율형사립고(이하 자율고)의 경쟁률이 크게 증가할 것으로 예상된다. 올해 특수목적고 및 자립형사립고 입시에서 내신의 비중이 커지면서, 평소 내신이 비교적 좋지 않은 학생들이 특목고나 자사고 대신 자율고를 선택할 가능성이 높아졌기 때문이다. 또 기존 인기 고교가 올해부터 자율고로 추가 전환된 것도 경쟁률을 상승시키는 원인이 될 것으로 보인다. 달라진 2011학년도 자율고 입시. 학생들은 변화된 자율고 입시에 맞춰 어떤 준비를 해야 하는지 살펴보자. 서울, 광주지역 자율고는 전 과목의 내신 성적을 반영한다. 내신 반영 시 주요교과에 대한 가중치를 부여하지 않으므로 서울, 광주지역 자율고 입시에 도전하는 학생들은 모든 과목의 내신 성적을 철저히 관리해야 한다. 대구, 부산지역 자율고는 지원자격 제한은 없으나 1단계에서 학교내신으로 2배수 내외를 선발한다. 학교내신은 국어 영어 수학 사회 과학 등 주요 5개 과목만 반영한다. 대구, 부산지역 자율고 입시를 준비하는 학생들은 주요교과 내신을 중점 관리해야 한다. 경기지역 자율고인 안산동산고는 1단계에서 국어 영어 수학 사회 과학 등 주요 5개 과목 내신 성적을 토대로 1.5배수를 뽑는다. 경북지역의 자율고인 김천고는 1단계에서 주요 5개 과목 내신 성적에 다른 1개 교과 내신 성적을 포함해 일정 인원을 선발한다. 충남지역 자율고인 천안북일고 역시 내신 교과를 통해 일정 인원을 선발할 계획이지만 반영과목은 아직 정해지지 않았다. 자율고 입시를 준비하는 학생들은 외고를 준비하던 학생들이 자율고 입시에 도전할 수 있다는 사실을 염두에 두고 국어 영어 수학 사회 과학 등 주요 5개 과목 내신 성적을 최소 4% 이내로 유지해야 한다. 자율고는 외고, 국제고와 달리 인문계열뿐만 아니라 자연계열로도 진학할 수 있으므로 영어뿐 아니라 다른 교과의 성적도 관리해야 한다. 서류전형에 대비하려면 계열에 관계없이 자신의 진로와 관련된 재능을 보유하는 것이 좋다. 교과목 중 자신이 특히 어느 과목에 우수한지 파악하고 그에 대한 이유를 생각해 둔다. 또 ‘앞으로 자율고에서 어떤 공부를 하고 싶은지’ ‘졸업 후엔 어떤 진로를 선택할 것인지’등에 대해 명확하게 의견을 정립한다. 외고와 마찬가지로 자율고 자기주도학습전형에도 학습계획서, 독서 및 체험활동, 봉사활동, 임원활동 등의 서류는 중요하게 작용할 것으로 예상된다. 따라서 본인의 학습 진행과정 및 결과, 성취내용 등을 철저히 관리하는 것이 좋다. 교과 특성과 관련된 자료를 확보해두면 자기소개서나 면접에서 자신의 진로 설정과 교과 전문성을 입증하는데 유리하다. 봉사활동은 지속적으로 해야 하며 학습계획서와 추천서 내용은 반드시 일치시켜야 한다. 독서활동은 면접 시에도 중요하게 작용할 수 있다. 외고와 마찬가지로 교육과학기술부 발표내용 이외 울산외국어고, 서울대, 포항공대 등 주요 대학 독서평가 내용도 확인해 둘 필요가 있다. 자신의 진로와 연관된 전공과 관련시켜 어떤 책을 읽었으며 그 책이 자신에게 어떤 영향을 미쳤는지 기록해 두는 것도 좋다. 김명식 목동 하늘교육 영재센터 중등부 3학년 팀장",https://news.naver.com/main/read.nhn?mode=LSD&mid=sec&sid1=102&oid=020&aid=0002136803
이기수 신임 대교협회장 “기여입학제 대학위해 필요” : 네이버 뉴스,2010.04.14,서울신문,"[서울신문]한국대학교육협의회 이기수 신임 회장은 ‘3불 정책’ 가운데 하나인 기여입학제 실시 여부와 관련, 13일 사견임을 전제로 “100억원 이상을 기부해 필요한 건물을 지으면 기부자의 2~3세에 대해 정원 외의 입학을 허용하는 제도가 대학교육을 활성화시킬 수 있는 한 방법이라고 생각한다.”고 말해 거액 기부자들에 대한 보상 차원의 기여입학을 허용할 수도 있음을 내비쳤다. 이 회장은 “정부가 어떻게 가닥을 잡아가는지 봐야겠지만 국가의 기본정책을 거스르지는 않겠다.”면서 이렇게 말했다. 이 회장은 이날 서울 상암동 대교협에서 열린 신임 회장 취임식에 앞서 가진 기자간담회에서 “대학 스스로 수익사업을 개발하거나 산학 협동으로 기업을 지원하면서 재원을 확충하는 한편 자발적인 헌금과 기부금이 확대될 수 있도록 대교협이 여건 조성에 앞장서겠다.”고 말했다. 3불 정책에 포함된 ‘고교등급제 및 본고사 금지’와 관련, 이 회장은 “2012년이후 국민적 합의를 통해 방침을 결정하겠다는 정부 정책에 동의한다.”고 말해 정부와 보조를 맞춰 나갈 것임을 시사했다.한편 이 회장은 지난 7일 대교협이 발표한 입학사정관제 공통기준에 대해 이전 집행부와 다소 다른 입장을 밝히기도 했다. 그는 “입학사정관제 시행과 관련해 대학들의 자율성을 최대한 존중해야 한다.”고 주장해 우회적으로 부정적인 입장을 피력했다. 홍희경기자 saloo@seoul.co.kr     [서울신문 다른기사 보러가기]	      ☞ ‘국민음료’ 칠성사이다 어느덧 환갑	      ☞ ‘고소의 여왕’ 철창에	      ☞ 서울시 7·9급 공채 평균경쟁률 157대1	      ☞ “집값 2013년부터 하락국면… 서울은 2018년”	      ☞ 하루 소주 8잔 이상 마신 男 뼈 건강은…	      ☞ ‘億치기’ 청각장애 날치기단	      ☞  아데바요르, 토고대표팀 은퇴	      ☞ 45년만의 ‘4월 영하’	      ☞ [1차 핵안보정상회의] “오바마의 페이버리트 맨 오셨다” 	      ☞ [천안함 본격 인양] “천안함 침몰원인 어뢰 격침 확신… 북한 잠수함 100% 감시 불가능”	      ☞ [천안함 본격 인양]  실종자가족협 “어뢰피격 결론”	      ☞ 판교 신도시에 은행 몰린다	      ☞ 북유럽식 복지 만병통치 아니다 ‘맛있는 정보! 신선한 뉴스!’ 서울신문(www.seoul.co.kr)[☞ 서울신문 구독신청] [☞ 서울신문 뉴스, 이제 아이폰에서 보세요]- Copyrights ⓒ서울신문사. 무단 전재 및 재배포 금지 -",https://news.naver.com/main/read.nhn?mode=LSD&mid=sec&sid1=102&oid=081&aid=0002075400
