title,date,press,contents,link
로스쿨 입시 법학적성시험 비중 커진다 : 네이버 뉴스,2016.03.13,세계닷컴,"시험 개선방안 8월까지 마련…2018학년도 신입생부터 적용법학전문대학원 입학에 필요한 법학적성시험(LEET·리트) 개선이 추진된다.교육부는 법학적성시험 시행기관인 법학전문대학원협의회에 최근 공문을 보내 시험 개선방안을 제출할 것을 요청했다고 13일 밝혔다.현재 법학적성시험은 5지선다형인 언어이해와 추리논증 영역, 서술형인 논술 등 3개 영역으로 구성돼 있다. 교육부 요청에 따라 협의회는 시험 구성과 방식 등을 바꾼 개선안을 8월까지 마련할 예정이다.이에 따라 법학적성시험 방식에 변화가 생기고, 각 대학의 법학적성시험 결과 반영 비율도 한층 높아질 것으로 보인다.교육부는 올해 초 업무보고에서 공정한 기회 확대와 전문성 강화를 위한 법학전문대학원 개선에 나서겠다고 밝힌 바 있다. 교육부는 법학적성시험 점수 등 객관적요소에 대한 비중을 확대하고 면접 등 정성요소를 보완, 제한적으로 활용하는 방향으로 선발 체계를 구축하겠다는 방침이다. 현재 각 대학이 법학적성시험 점수를 대학별로 다르게 반영하고, 면접 등을 거쳐 신입생을 최종 선발한다. 시험 개선은 법학적성시험 반영 비율을 높이기 위한 정지 작업인 셈이다. 변화되는 시험은 내년 7월 치러지는 2018학년도 신입생부터 적용될 것으로 보인다.김예진 기자 yejin@segye.com[핫] 알면서 말 못하는 입 냄새…이렇게 없애라[이슈]""연예계 생활 유지하려""… 성매매 유혹에 빠져ⓒ 세상을 보는 눈, 글로벌 미디어 세계일보",https://news.naver.com/main/read.nhn?mode=LSD&mid=sec&sid1=102&oid=022&aid=0003030892
[기자의 눈/김희균]“한해 대입 두차례” 뜬금없는 교육장관 : 네이버 뉴스,2016.02.25,donga.com,"[동아일보]김희균·정책사회부23일 오전 교육부는 ‘기사의 내용은 교육부 차원에서 검토된 사항이 아님’이라는 한 줄짜리 해명자료를 냈다. 이준식 사회부총리 겸 교육부 장관의 지시 사항을 보도한 기사에 대한 해명이었다. 이 장관은 전날 교육부 간부회의에서 “3월, 9월 두 차례 대학 신입생을 선발하는 방안을 검토하라”고 지시했다.  부처를 지휘하는 장관이 검토하라고 지시한 사항을 놓고 “부처 차원에서 검토된 사항이 아니다”라고 이상한 해명을 하고 나선 것이다. 문제의 발단은 교육 정책의 흐름을 읽지 못하고 뜬금없는 지시로 혼란을 키운 이 장관의 발언에 있다. 대학 입시는 공교육 현장을 들었다 놨다 하는 민감한 문제다. 당장 해당 보도를 접한 전현직 대학 입학처장들이 기자에게 전화를 걸어 “이게 도대체 어떻게 된 일이냐”고 물어볼 정도였다.  대학 입시를 복수로 치르는 방안은 이미 참여정부 때부터 몇 차례 논의만 됐다가 사장된 내용이다. 국제 기준에 맞춰 9월 학기제를 도입하거나, 혹은 고교 내신만으로 학생을 우선 선발하자는 취지라는 등 이유는 다양했다. 하지만 초중고교의 학사 일정을 모두 바꿔야 하는 등 복잡한 문제라서 결과적으로 시도되지 못했다. 이런 이력을 무시한 채 “대학원은 일 년에 두 번 입학하는데 대학도 그렇게 하면 되지 않느냐”고 단순 논리를 펴는 것은 주무 부처 장관의 현실 인식이 얼마나 부족한지를 단적으로 보여주는 것이다. 이런 어처구니없는 해프닝은 취임 두 달이 되어 가는 이 장관이 교육 현안에 대한 대처 능력이나 정책적 비전을 제시하지 못한 것과 무관하지 않다.  취임 이후 누리과정 예산 미편성에 따른 보육대란으로 교육 현장은 물론이고 온 사회가 들끓었지만 이 장관은 유치원과 어린이집을 몇 군데 방문한 것 외에는 주목할 만한 행보를 전혀 보여주지 못했다. 교육감들과 만난 자리에서 일방적으로 정부의 입장만 피력하고 자리를 떠나 원성을 사기도 했다. 교육부가 정부 논리만 되뇌는 사이 각 지역의 누리과정 예산은 교육청, 지방자치단체, 의회 간의 땜질 처방으로 누더기가 됐다. 이 장관은 인사 청문회 당시 뜨거운 이슈였던 국정 역사 교과서 문제에 대해서도 “적절한 발표 시점을 정해 투명하게 처리하겠다”고 했지만 아무런 조치 없이 비공개로 일관하고 있다. 부총리 겸 장관으로서 교육 현장의 갈등을 조정하고 현안을 제대로 처리할 능력이 있는지 의구심이 드는 이유다.  김희균·정책사회부 foryou@donga.com[☞오늘의 동아일보][☞동아닷컴 Top기사][☞채널A 종합뉴스]",https://news.naver.com/main/read.nhn?mode=LSD&mid=sec&sid1=102&oid=020&aid=0002949704
[입시 '족집게'] 2017학년도 고려대 입시전망 : 네이버 뉴스,2016.04.05,부산일보,"수시, 논술 영향력 '절대적'… 정시, 한국사 가산점은 최고 10점  고려대 2017년 입학전형은 2016년 입학전형의 틀을 유지하면서 전형별 모집 인원을 일부 조정했다. 수시 일반전형(논술전형)과 정시 일반전형의 모집 인원은 감소하고, 학교장추천전형·융합형인재전형·과학인재전형 모집 인원은 늘어난다. 특히 융합형인재전형은 전년도에 비해 145명이 증가한 505명을 모집한다.수시 일반전형은 논술전형으로 학생부 교과 30%, 학생부 비교과 10%, 논술 60%를 반영한다. 학생부 영향력은 미미하고 논술의 영향력이 절대적이다. 학생부 교과는 1~4등급 각 등급별로 0.2점 정도밖에 차이가 없으며, 학생부 비교과는 '사고결석 총 2일 이내', '봉사활동 40시간 이상', '수상 경력 총 3개 이상'이라는 조건 중 2개 이상 충족하면 만점을 준다. 논술시험은 수능 이후인 11월 26일 실시되며, 인문계는 수리논술 1문항 포함하여 2문항이 출제된다. 자연계는 수학은 필수, 물리·화학·생명과학·지구과학 중 하나를 선택(모집 단위에 따라 과목 제한이 있음)할 수 있다.학생부 위주 전형인 학교장추천전형과 융합형인재전형 간에 복수 지원은 허용되지 않는다. 학교장추천전형은 인문계 모집단위 2명, 자연계 모집단위 2명을 고등학교장이 추천할 수 있다. 특목고, 특성화고, 전문계 과정 이수자, 검정고시는 제외되며, 올 입시부터 재학생만 지원할 수 있다. 단계별 전형을 하며, 1단계 서류 100%, 2단계는 1단계 성적 70%, 면접 30%를 반영한다. 1단계에서 학생부 교과의 반영 비율이 전년도보다 10% 늘어난 90%이다. 학생부 비교과, 자기소개서, 추천서 등을 종합평가(10%)한다.융합형인재전형 지원 자격은 '자신의 전공 분야를 선도할 창의적 사고력과 역량을 가진 자'로 규정되어 있다. 특정 분야의 뛰어난 능력뿐만 아니라 다른 분야와의 융합, 능력이 있는 자를 대상으로 한다고 볼 수 있을 것이다. 학교생활기록부, 자기소개서, 추천서 등을 종합적으로 평가한다.고려대 실기 위주 전형은 국제인재, 과학인재, 체육인재로 분류되어 있다. 1단계에서 서류 100%로 3배수(과학인재 5배수) 안팎을 선발하며 2단계에서 1단계 성적 70%, 면접 30%로 최종 선발한다. 국제인재는 외국어(영·독·불·중·노·일·서어) 특기자를 모집한다. 외국어 역량, 고교 성적, 고교 재학 중 활동 등과 관련된 지원자의 제출 서류를 종합적으로 평가한다. 과학인재는 자연계열 모든 학과에 응시 가능하며, 수학 및 과학 관련 역량과 고교 재학 중의 활동 등 지원자의 제출 서류를 종합적으로 평가한다. 체육인재는 체육활동 우수성, 전공적합성, 인성 등 미래 체육을 이끌어갈 지도자로서의 기본 소양을 평가한다.학생부 위주 전형과 실기 위주 전형에서 1단계 학생부 교과 및 서류, 2단계 면접 중요도와 난이도가 상승 추세이다. 면접은 2인 이상의 면접위원이 평가한다. 면접 시 고려해야 할 요소 중 하나인 학교 인재상이 변경되었다. 전년도에는 성실성, 리더십, 창의성, 전공적합성, 공선사후정신이었으나 올해는 '개척하는 지성', '창조적 인재', '정의로운 리더', '지혜로운 인재'이다. 학교장추천전형은 제시문에 대한 질문을 통해 지원자의 역량을 종합 평가한다. 제시문 숙독 12분, 면접 6분(2016학년도 기준)으로 진행된다. 융합인재전형은 제출서류의 내용을 심층적으로 확인하고, 제시문에 대한 질문을 통해 창의적·융합적 사고 능력을 확인한다. 최저학력 기준은 대체로 전년도 수준으로 적용되었다. 다만, 일반전형과 학생부 위주 전형의 의과대학은 3개 영역 등급의 합이 4에서 3으로 강화되었으며, 자연계 학생부 위주 전형은 2개 영역 합이 4에서 5로 완화되었다. 기회균등특별전형의 사회배려자와 특수교육대상자는 수능최저학력기준이 폐지되었다. 올해 필수 응시 영역이 된 한국사의 최저 등급은 인문계열 3등급, 자연계열 4등급이다.정시는 수능 위주 전형이다. 일반 학생을 대상으로 하는 '일반전형'과 특별한 자격을 갖춘 학생을 대상으로 하는 '기회균등특별전형' '농·어촌학생'으로 나뉜다. 전년도와 마찬가지로 나군에서 선발하며 정시모집 인원은 소폭 줄어들었다. 일반전형은 수능 90%, 학생부 교과 8%, 학생부 비교과 2% 비율로 반영한다. 모집 단위별로 수능 지정 응시 영역이 있으며, 인문계 모든 모집단위와 가정교육과, 체육교육과는 수학 가/나, 사회탐구/과학탐구를 허용한다. 자연계열은 수학 가와 과학탐구에 가중치가 있다. 한국사 가산점 만점은 10점이며 인문계열은 1~3등급, 자연계열은 1~4등급에 10점 만점을 부여한다. 인문계 모집 단위에서는 제2외국어/한문 영역으로 탐구 1과목을 대체할 수 있다.농·어촌학생은 1단계에서 수능 70%, 서류 30%를 반영하여 모집 단위별 모집 인원의 2배수 내외를 선발한 후 2단계에서 1단계 성적 70%와 면접 30%를 합산하여 최종 합격자를 가린다. 전형 과정에 입학사정관이 참여하며 고교 교육과정의 다양한 전형자료를 평가에 반영한다. 최저학력기준이 있다. 강상원부산진학지도협의회 전문위원(대덕여고)",https://news.naver.com/main/read.nhn?mode=LSD&mid=sec&sid1=102&oid=082&aid=0000590180
