title,date,press,contents,link
앞으로 2년간 교교 입학생 13만명↓…대입에도 영향 전망 : 네이버 뉴스,2016.04.03,세계닷컴,"2016학년도 대학수학능력시험이 열린 지난해 11월 12일 서울 중구 정동 이화여자고등학교에서 시험을 마친 수험생들이 나오고 있다.앞으로 2년간 고교 입학생이 10만명 이상 급감할 거라는 예측이 나왔다.3일 교육부에 따르면 올해 총 59만6066명인 전국 고등학교 입학생 수가 내년에는 52만6895명으로 약 7만명 가량 줄어들 전망이다. 올해 입학생 수는 작년 4월1일의 중학교 3학년 학생 수를 근거로 한 것이다.2018년에는 입학생 수가 46만2990명으로 50만명 아래로 떨어진다. 이는 전년 대비 6만3900여명 줄어든 것이다. 올해와 비교하면 무려 13만여명이 감소한다.고교 입학생 수 감소는 갑작스레 벌어진 일이 아니다. 이미 2013년의 60만9144명, 59만2175명(2014년), 58만6947명(2015년) 등 매년 1만명 내외로 꾸준히 입학생이 줄어들었다.올해 입학생 수가 소폭 늘어난 것은 ‘밀레니엄 베이비’ 때문으로 교육계는 분석했다. 2000년에 태어난 세대가 이번에 고등학교에 들어갔기 때문이다.서울시 교육청은 최근 시내 일반계 고교에 2018년까지 학급 700개를 줄여야 한다는 공문을 보냈다. 학생 감소로 700개 정도의 학급이 남아돌 수 있다며, 학급당 학생 수를 줄이면 감소할 학급 수 규모는 조정할 수 있다고 교육청은 설명했다.입학생 수 감소는 대학입시에도 영향을 미칠 가능성이 있다. 4년제와 전문대를 포함한 현재 대학 정원이 총 55만명 수준임을 보면, 오는 2021년쯤에는 학생 수가 대학 모집 정원을 밑돌아 경쟁률도 크게 낮아질 것으로 추정된다.김동환 기자 kimcharr@segye.com[연구] 첫만남에서는 쩍벌남이 매력남이 된다[핫]""2년 쉬면…"" 폭행·도박·성매매… 까보면 또 그 사람ⓒ 세상을 보는 눈, 글로벌 미디어 세계일보",https://news.naver.com/main/read.nhn?mode=LSD&mid=sec&sid1=102&oid=022&aid=0003039372
대입 실패한 청소년들에게… 하나님 계획 신뢰하고 담대히 재도전하라 : 네이버 뉴스,2016.02.12,국민일보,"지난해 말 대학수학능력시험 성적표를 받은 수험생과 어머니가 지원 가능한 대학이 표시된 배치표를 보고 있다. 대입 실패는 인생의 위기로 보이지만 자세에 따라 축복의 통로가 된다. 국민일보DB 인생에는 시험이 있다. 아브라함에게는 아들을 하나님에게 바치는 시험이 있었고, 요셉에게는 애굽의 노예로 팔려가는 역경이 있었다. 이들은 이 시험을 거쳐 ‘하나님의 사람’이 됐다. 인생의 시험은 하나님의 도구로 단련되는 과정(욥 23:10)이다. 대학 낙방, 입사 좌절…. 사회 초년기 시험도 마찬가지다. 청소년 전문 사역자들은 12일 “시련이 있을 때 하나님의 계획을 신뢰하고 담대한 마음으로 재도전하라”고 조언했다.대입 실패, 어쩌면 인생의 첫 위기 지난 연말에도 대학수학능력시험 결과에 낙담한 청소년이 몸을 던졌다는 보도가 잇따랐다. 근래에는 공무원 채용 시험에 실패한 청년이 가족에게 이 사실을 숨겨오다 목숨을 끊었다는 소식이 들렸다. A양(19)은 최근 고교 졸업 전 지원한 6개 대학에서 줄줄이 불합격 통보를 받고, 15일 개강하는 재수학원에 등록한 상태다. 그는 “우울하고 답답하다”고 토로했다. 대입 실패는 인생에서 처음 겪는 위기가 될 수 있다. 매년 11월 수능 당일 수험생을 위한 찬양집회를 열고 있는 천관웅 뉴사운드교회 목사는 “하나님의 긴 계획 속에서 보면 대입은 작은 점(點)에 불과하다”며 “자녀를 향한 하나님의 선하고 신실한 뜻을 믿어야 한다”고 말했다. 크리스천 자녀나 부모가 입시 결과로 시험에 빠지기도 한다. “나는 매주 예배도 드렸는데, 예배도 안 드리던 ○○이는 대학에 합격하고….” “신앙생활 소홀히 하는 ○집사 아들은 대학에 척척 붙는데, 왜 우리 애는 떨어졌나요?” 위로해야 할 부모가 자녀에게 상처를 주기도 한다. “내가 너 때문에 교회에서 얼굴을 못 들겠다!”입시 표어, ‘합격은 은혜, 재수는 축복’ 우리가 하나님의 공의를 의심하고 사랑을 회의하는 건 아닌지 돌아봐야 한다. 서울 영락교회(이철신 목사)에는 재수생으로 구성된 베드로부가 있다. 베드로부를 포함해 고등부 전체를 총괄하는 함승수 목사는 “베드로부에서 자주 하는 말은 ‘붙으면 은혜, 떨어지면 축복’이다. 하나님이 우리 아이들을 만들어가는 과정이라는 관점에서 재수를 봐야 한다”고 강조했다. 남들보다 더 길고 힘겨운 입시를 거치면서 인내, 겸손, 성실을 배우게 된다는 것이다. 베드로부를 거쳐 간 청년 중에는 ‘바보 의사’란 별명으로 유명한 고 안수현이 있다. 함 목사는 “성경은 시련을 거치면서 우리가 정금같이 된다고 했다. 우리 자녀들도 재수를 통해 인생의 고난에 대처하는 법을 배울 수 있다”고 했다. 지난해 재수를 한 B씨(20)는 올해 원하는 대학에 합격했다. B씨가 출석하는 교회 담당 목사는 “주일 예배 때마다 주보를 나눠주던 모습이 눈에 선하다”며 “밝고 씩씩한 ○○의 모습은 다른 선후배들에게 큰 기쁨을 줬다”고 소개했다. B씨는 교단의 성경고사대회에서 1등을 할 정도로 말씀을 가까이하던 청년이었다. 말씀을 따르고 묵상하면 그 길이 평탄하고 형통하다(수 1:7∼8)고 했다. “시험 치기 전에 인생 계획부터 세워라” 입시 결과에 좌우되지 않으려면 인생 계획이 분명해야 한다. 사랑의교회(오정현 목사)에서 고3부를 담당하는 김경덕 목사는 “어릴 때부터 달란트를 발견하고 진로 계획을 세워야 한다. 그러면 한 차례 입시에 실패하더라도 용기를 내 꿈을 향해 나아갈 수 있는 힘이 있다. 대학에 가더라도 자기 인생의 목표를 정하지 못해 30대가 될 때까지 꿈을 찾아 헤매는 경우가 허다하다”고 전했다. 올해 대입에 실패한 C양(19)은 재수를 준비하고 있다. 지난달 빵 가게에서 아르바이트해 번 돈으로 작은 케이크를 사 김 목사를 찾아 왔다. C양은 “그동안 기도해주셔서 감사하다. 제가 번 돈으로 감사 인사를 드리고 싶었다”고 했다. 김 목사는 “C양은 하나님 안에서 자라고 있고 꿈이 분명하다. 그 아이의 미래는 걱정되지 않는다”고 했다. 재수생은 고교를 졸업했지만 대학은 유예된 상태다. 김 목사는 “심리적으로 위축되고 불안정한 재수생은 스트레스를 푸는 과정에서 일탈할 수 있다. 가족들이 신앙을 지키고 꿈을 잃지 않도록 지지해야 한다”고 조언했다. 재수생이 주일 오전 예배를 드리도록 격려하고, 학원에 심방을 가는 것도 좋은 방법이다. 수험생은 마음의 기쁨을 잃지 않도록 노력해야 한다(빌 4:4). 시험은 짧고, 인생은 길다.강주화 기자 rula@kmib.co.krGoodNews paper ⓒ 국민일보(www.kmib.co.kr), 무단전재 및 재배포금지[뉴스 미란다 원칙] 취재원과 독자에게는 국민일보에 자유로이 접근할 권리와 반론·정정·추후 보도를 청구할 권리가 있습니다. 고충처리인(gochung@kmib.co.kr)/전화:02-781-9711",https://news.naver.com/main/read.nhn?mode=LSD&mid=sec&sid1=103&oid=005&aid=0000869917
대학 입학생 성적공개 '판도라의 상자' 열릴까 : 네이버 뉴스,2016.03.25,financial news,"대학 합격자들의 성적정보를 공개해 입시제도를 공개하는 대입정보포털 '어디가'가 25일 개통됐다. 교육부와 한국대학교육협의회는 사교육기관에 의존하지 않고 입시를 준비할 수 있게 됐다는 기대감을 나타냈지만 시스템의 핵심인 입학성적공개를 놓고 벌써부터 얘기가 무성하다. 특히 매년 입시제도가 달라지고 대학들도 전형에 변화를 주고 있어 전년도 입학성적을 공개하는 것이 혼란만 줄 수도 있다는 우려도 제기된다.■대학들 입학성적 '판도라 상자' 열릴까25일 교육부는 오는 8월까지 대학들의 성적정보를 '어디가'에 탑재해 9월에 시작하는 2017학년도 수시전형 접수부터 활용할 수 있게 할 예정이다. 수험생이 수시·정시전형별로 대학과 전형유형, 세부유형, 모집단위 등을 선택하면 대학들이 제출한 성적정보를 통해 올해 입시를 예측해 볼 수 있다.관건은 대학들이 '민낯'이라고 할 수 있는 성적정보 공개 여부다. 대교협은 수시전형의 경우 합격자의 내신 등급, 정시는 상위 70%, 80%, 90%의 성적을 공개할 것을 요구한 것으로 알려졌다. 하지만 서울 주요대학들은 정보공개의 후폭풍을 우려하는 분위기다. 성적정보 공개 자체를 보이콧 해야 한다는 입학처장이 나올 정도다.           25일 숙명여대 백주년기념관에서 열린 대입정보포털 개소식에서 이준식 교육부장관이 기념사를 하고 있다.        서울지역 A대학 입학처장은 ""교육부의 계획 대로라면 전국 200여개 대학의 성적을 나열하게 되는 방식인데 그것을 어떻게 감당할지 모르겠다""면서 ""오히려 사교육업체들의 신뢰도만 높이는 도구가 될 수 있다""고 우려했다. 특히 ""대학마다 자체적으로 점수를 환산해 학생들을 뽑기 때문에 성적정보를 공개한다고 해서 학부모들이 객관적인 기준으로 삼기는 부적절하다""고 강조했다.뿐만 아니라 현재도 입학정보는 충분히 제공되고 있다는 시각이다. 대학마다 고등학교에서 요청을 하면 해당 학교에서 지원한 학생들의 자세한 성적 정보 등을 제공하고 있다고. 세부적인 입학정보를 공개된 곳에 올린다고 해서 입시에서 학부모나 학생이 실질적으로 도움을 받을 부분은 많지 않다는 의견이다.B대학 관계자도 ""점수를 공개한다고 해서 그것이 지원의 기준이 될지는 의문""이라며 ""특히 전년도 정보만 믿고 지원했다가 지원자가 몰려 탈락하게 되면 그 책임은 누가져야 하느냐""고 고개를 내져었다. 또 ""비슷한 위치의 대학들은 자칫 정보를 공개했다가 내부 구성원들의 강력한 반발을 살 수도 있다""고 덧붙였다.A대학 입학처장은 ""교육부가 이처럼 민감한 사안을 추진하면서 관련 공문을 보낸 적도 없다""면서 ""대학들의 입시 책임자들을 불러 의견을 수렴하고 진행했어야 했다""고 지적했다.■""정보공개 현실에 안맞다"" 지적도대학들의 성적정보 공개와는 별개로 실질적으로 수험생들이 지원하려는 대학·학과를 선택하는데 큰 도움이 못될 것이라는 의견도 제기된다. 가장 큰 이유는 매년 입시제도가 바뀌고 대학들도 자체적으로 전형 비율을 변경하고 있다는 점이다.한 입시정보업체 관계자는 ""당장 올해 수능에서 국어영역이 통합되고 내년에는 영어 절대평가가 시행된다""면서 ""올해 입시에서 지난해 성적을 활용하는 것은 사실상 의미가 없다""고 지적했다. 여기에 대학들이 모집군을 변경하거나 전형요소의 비율을 조정하게 되면 지난해 입학성적 결과를 기준으로 삼기에 부적하다는 의견들이다.           25일 숙명여대 백주년기념관에서 열린 대입정보포털 개소식에서 학생이 시연을 하고 있는 모습.        또다른 입시업체 관계자는 ""지금의 입시는 여러가지 전형요소가 복합적으로 조합되는 방식으로 특정 학과에 합격하는 방법도 많으면 5~6가지나 된다""면서 ""세밀한 자료를 공개하더라도 대학 서열화를 국가에서 인정해주는 격이 된다""고 말했다. 특히 ""예측이 힘들 정도로 입시제도를 급격하게 바뀌고 있는 상황에서 과거 데이터를 공개하는 것은 맞지 않다""면서 ""이런 자료를 공개하려면 입시제도가 공고화 되고 입학전형과 성적의 연관관계가 명확해야 한다""고 강조했다.결국 알리고 시스템 성공의 핵심이 '예측'이라는 점에서 실효성에 의문이 제기된다는 것이다. 이 관계자는 ""표본의 양은 많아지겠지만 조합의 변수가 많기 때문에 입시 자료중 하나 정도로 인식될 수 있다""면서 ""교육부의 의도와는 달리 이 자료를 분석, 가공할 수 있는 입시정보기관의 신뢰도만 높여줄 수도 있다""고 주장했다.한편 교육부는 이달말 서울지역 9개 대학 입학처장들을 만나 지난해 입학생의 성적정보 공개에 관해 논의를 할 예정이다.cynical73@fnnews.com 김병덕 기자    ※ 저작권자 ⓒ   파이낸셜뉴스. 무단 전재-재배포 금지",https://news.naver.com/main/read.nhn?mode=LSD&mid=sec&sid1=102&oid=014&aid=0003623855
"국제전형 알면 재수NO, 수험생들의 이유 있는 선택 '미국대학입시' : 네이버 뉴스",2016.01.26,세계닷컴,"과열된 입시경쟁은 어제 오늘의 일이 아니다. 2016학년도 수능 응시생 63만 명 중 서울대, 고대, 연대 소위 ‘스카이(SKY)’ 대학에 진학하는 수험생은 1만 명도 채 되지 않는다. 서울에 소재한 ‘인(in)서울’ 대학 관문도 좁기는 마찬가지다.문제는 과열된 입시 현실과 맞물려 학부모들은 욕심을 버리지 못한 채 바늘구멍 같은 명문대만 바라보며 생활비 대부분을 학원비에 쏟아 붓고 있는 현실이다.게다가 수험생들의 입시 스트레스는 이미 위험 수위를 넘어 섰고, 1점 차이로 희비가 엇갈리는 국내 입시 현실 속에서 학생들은 진로와 전공을 모색할 기회조차 박탈당하고 있다.이와 관련해 텍사스주립대 한국교육원은 현재 텍사스주립대 정규 신(편)입학을 보장하는 프로그램을 운영하며 전공별 신입생을 모집 중이다. 국내 입시가 미국의 우수한 입학사정관 제도를 따라 학생부종합전형이 정착돼 가고 있다. 운 좋게 좋은 대학에 들어갔다 해도 제2의 입시인 취업난이 기다리고 있다.그렇다고 명문대 졸업장이 100% 취업을 보장하는 것도 아니거니와 인 서울 대학은 물론 지방대의 경우, 취업의 관문은 더욱 비좁기만 하다.그러나 남과 다르게 글로벌 혜안을 갖는다면 얘기는 달라진다. 입학사정관 제도의 본거지이자 교육 선진국인 미국 대학 입학이 바로 그것.텍사스주립대의 지원자격은 고등학교 졸업(예정)자, 전문대학 졸업(예정)자, 2년제와 4년제 대학 중퇴자이고 서류심사와 심층 면접을 거쳐 30명을 선발한다.경영대, 공대, 예체능대 등 100여 개 전공 중에 선택할 수 있으며, 졸업 후 OPT 프로그램으로 글로벌 인턴십과 취업 기회를 얻을 수 있다.오는 27일(수) 오후 2시 분당구 정자역 공감나누기, 1월 28일(목) 오후 2시 부천 세이브존 부천상동점 4층, 1월 29일(금) 오후 2시 범계역 삼희월드플라자 8층, 1월 30일(토) 오후 2시 서울 삼성동 코엑스 컨퍼런스홀 313호에서 각각 설명회를 진행한다.강남과 분당, 송파와 안양 및 부천에서 진행되는 설명회에 대한 자세한 안내는 전화(02-457-4565) 가능하다. ⓒ 세상을 보는 눈, 글로벌 미디어 세계일보",https://news.naver.com/main/read.nhn?mode=LSD&mid=sec&sid1=103&oid=022&aid=0003003337
"‘로스쿨 입시비리’ 폭로 교수, 징계 위기 : 네이버 뉴스",2016.04.01,헤럴드경제,"[헤럴드경제] 자신이 속한 법학전문대학원(로스쿨)의 입시비리 의혹를 폭로한 경북대 신평 교수가 학교로부터 징계 위기에 처했다. 1일 경향신문 보도에 따르면 경북대 로스쿨 김문재 원장은 전날 “신 교수가 최근 제기한 입시비리 의혹은 사실이 아니란 것이 학교의 기본적인 입장”이라며 “학과 교수회의에서 현재 신 교수에게 정식으로 확인요구서를 보낸 상태다. 사실을 확인하지 못할 경우 징계 등 모종의 조치를 취할 예정”이라고 밝혔다.앞서 신 교수는 지난 10일 발간한 <로스쿨 교수를 위한 로스쿨>에서 “한 로스쿨 교수가 아는 변호사의 청탁을 받고 그의 자녀를 입학시켜 주기 위해 동료 교수에게 입학 청탁을 했다”고 밝혔다. 논란이 일자 일부 단체들은 부정입학 의혹에 대해 경찰에 수사를 의뢰하기도 했다.경북대 로스쿨은 “전국에서 가장 엄격한 입학절차를 가지고 있는 만큼, 이번 논란은 말이 안된다”고 주장했다. 김 원장은 “실제 그런 일이 있다해도 내부적으로 문제를 제기할 수 있었을텐데 신 교수는 책까지 냈다”라며 “특히 그는 사법시험 존치를 주장하는 서울지방변호사회로부터 지원을 받아 책을 냈다. 사시존치 입장에 치우친 일방적이고 주관적인 생각을 책에 실은 것으로 볼 수 있다”고 말했다.신 교수는 대학 측 반응을 납득할 수 없다는 반응이다. 신 교수는 “책에는 분명한 사실을 말한 것이라 대학이 실제 날 징계할 수는 없을 것”이라며 “다만 누가 청탁을 받았는지 말을 해도 당사자가 말을 맞춰버리면 문제는 덮어지고, 학교가 내 주장을 허위라고 주장할 수 있다”고 우려했다. 그는 또 “학교 측은 내 책이 ‘로스쿨 흠집내기’를 위한 책이라 주장하는데 구체적인 근거를 밝혔으면 좋겠다”라며 “그것이 학자이자 선생이기 위해 갖춰야 할 최소한의 조건”이라고 덧붙였다.서울변회도 반발했다. 서울변회는 “변호사나 법학자들의 출판작업에 지원한 건 이제까지 계속해 온 사업”이라며 “신 교수는 그간 로스쿨에 계속 몸담아 왔던 인사였고 책의 내용 자체도 로스쿨에 해를 끼치려는 목적이 아닌, 충분히 문제제기할 가치가 있는 것이었다”고 말했다. 서울변회는 “로스쿨의 진정한 발전을 위한다면 건전한 비판을 겸허히 받아들이는 자세가 필요하다”라며 “건설적인 지적을 한 내부 인사를 압박하는 것이 올바른 것인지 의문”이라고 전했다. onlinenews@heraldcorp.com▶ 오바마-시진핑 길어진 얘기에, 1시간 기다린 박 대통령▶ 北 GPS 교란, 선박·항공기 피해…스마트폰까지 ‘사이버 테러’▶ ‘한우 미스테리’…수요 늘고 값 오르는데, 왜 사육은 줄까?[글로벌 인재들의 필수 역량, SKEC 영어글쓰기대회] [주니어 영어 신문의 가장 효율적인 학습 서비스][헤럴드경제] [SUPERICH] [REAL FOODS] [헤럴드증권방송] [HOOC]- Copyrights ⓒ 헤럴드경제 & heraldbiz.com, 무단 전재 및 재배포 금지 -",https://news.naver.com/main/read.nhn?mode=LSD&mid=sec&sid1=104&oid=016&aid=0001024170
2018학년도 입시 주요 11개 大 신입생 10명 중 8명 수시 모집 : 네이버 뉴스,2016.04.02,강원일보,"2018학년도 대입에서 서울 시내 주요 대학들이 신입생 10명 중 8~9명을 수시모집으로만 선발한다. 서울대 연세대 고려대 성균관대 서강대 한양대 중앙대 경희대 한국외대 이화여대 숙명여대 등 서울 시내 주요 11개 대학은 최근 `2018학년도 대입 전형 시행 계획'을 한국대학교수협의회에 제출했다. 각 대학의 시행 계획에 따르면 이들 대학 입시에서는 수시 모집이 확대되고 정시는 축소된다. 서울대는 전체 모집 인원 중 전년보다 84명 늘어난 2,491명(78.4%)을, 고려대는 2018학년도 수시 선발 비중을 전년도보다 10% 늘어난 85%로 올렸다. 연세대는 수시 모집이 2,405명에서 2,402명으로 다소 줄었다. 하지만 2017학년도에 수시로 뽑는 예능계열 23명이 2018학년도에는 정시로 넘어간 결과여서 실제 수시 모집은 늘어났다. 이화여대는 수시 모집 비중을 83.3%로 전년 대비 9.1% 포인트 늘렸다. 장현정기자",https://news.naver.com/main/read.nhn?mode=LSD&mid=sec&sid1=102&oid=087&aid=0000607040
