title,date,press,contents,link
'대입 포기' 10대·'인생 이모작' 50대...공무원 시험 열풍 : 네이버 뉴스,2016.02.02,YTN,"[앵커]  올해 국가공무원 9급 공채 시험에 역대 최대 인원이 원서를 접수했습니다.    특히 20∼30대는 물론 대학진학 대신 공무원을 선택한 10대와 인생 이모작을 노리는 50대 지원자도 지난해보다 크게 증가했습니다.   오인석 기자의 보도입니다.   [기자]   경기불황과 고용 불안정이 심화하면서 9급 공무원 공채시험 지원자가 급증하고 있습니다.   응시원서 접수 마감 결과 4천120명 선발에 역대 최대 인원인 22만 2천650명이 접수해, 54대 1의 경쟁률을 보였습니다.   접수 인원이 지난해보다 16.6%나 증가했습니다.   모집직군별로는 행정직군이 52.6대1의 경쟁률을 보였고, 기술직군은 68.7대1로 나타났습니다.   지원자의 평균 연령은 28.5세로 지난해 28.6세와 비슷했고, 여성 비율은 53.6%로 지난해 52.7%보다 올랐습니다.    눈에 띄는 점은 20세 미만과 50세 이상 지원자의 증가세입니다.   20세 미만 지원자 수는 2,160명에서 3,156명으로 46.1% 증가했습니다.   50세 이상도 768명에서 957명으로 24.6% 늘었습니다.   명문대 출신들도 취업난으로 9급 공무원에 대거 몰리는 상황에서 대학 진학 대신 공무원이 되려는 10대들의 수요와 함께 고용안정성이 불확실한 중장년층까지 합세한 것으로 분석됩니다.   필기시험은 오는 4월 9일 전국 17개 시도에서 실시 됩니다.    YTN 오인석입니다.  ▶ 지하철이 안방?' 발톱 깎는 여성 비난 폭주  ▶ 결혼할 남자 빚 대신 갚아주고 사랑도 뺏긴 싱글맘   [저작권자(c) YTN & YTN PLUS. 무단 전재-재배포 금지]",https://news.naver.com/main/read.nhn?mode=LSD&mid=sec&sid1=102&oid=052&aid=0000769323
"황영철 후보, ""국가보훈대상자 대학입학 기회 확대"" : 네이버 뉴스",2016.04.05,뉴스1,"황영철  새누리당 후보 (뉴스1 DB) © News1(홍천,철원,화천,양구,인제=뉴스1)  정진욱 기자,박태순 인턴기자 = 제20대 국회의원 선거 새누리당 황영철 후보는 5일 '국가보훈대상자 대학입학 기회 확대' 공약을 발표했다. 황 후보는 “3선 국회의원이 되면 국회보훈대상자의 대학입학 기회를 확대하고 ‘정원 외 대학입학 특별전형’의 법적 근거를 마련하기 위해 국가유공자 등 국가보훈처 소관의 관련법률 개정안을 발의하겠다”고 밝혔다. 황 후보에 따르면 이 개정안은 대학 정원의 일정 비율 범위 내에서 국가보훈대상자를 정원 외로 선발할 수 있는 근거를 마련하는 것이 주요 내용이다. 현재 국가보훈대상자의 정원 내 특별전형은 상당수의 대학에서 자율적으로 실시하고 있으나(2016년도기준, 4년제 대학213개 중 156개실시) 대학 정원 외 특별전형은 법적 근거가 없다. 황 후보는 “국가를 위해 헌신한 사람을 최우선으로 책임지는 것은 국가적 책무이다. “국민의 나라사랑정신 함양을 위한 효과적인 정책""이라며 “교육분야에 대한 배려는 국가를 위해 희생한 사람과 그 후손들에게 꼭 필요하다”고 밝혔다.bigts@▶ 핫이슈- 광주 8개 선거구 여론조사 보니… 국민의당 7 vs 더민주 1",https://news.naver.com/main/read.nhn?mode=LSD&mid=sec&sid1=102&oid=421&aid=0001983139
"메가스터디,대입 목표달성 장학생 모집 : 네이버 뉴스",2016.03.28,financial news,"메가스터디교육의 고등부 사이트 메가스터디가 올해 수능시험을 준비하는 수험생들을 대상으로 목표달성 장학생 선발 이벤트를 진행한다.올해로 13년째를 맞은 목표달성 장학생 선발 이벤트는 본인이 목표한 대학/학과에 최종 합격한 학생들을 가려내 장학금을 수여하는 장학 프로그램으로 올해는 25명을 선발해 1인당 400만원씩 총 1억원의 장학금을 지급할 예정이다.수험생이면 누구나 도전 가능하며 오는 4월30일까지 메가스터디 사이트 내 관련 게시판에 본인의 목표 대학/학과와 다짐글을 등록하면 된다. 메가스터디는 올해 7~8월경 수험생들을 대상으로 목표대학 및 학과를 수정할 수 있는 2차 도전 기회를 마련할 예정이다. 또 내년 1~2월에는 각 대학별 합격자 발표 직후 본인이 등록한 목표대학/학과에 최종 합격한 수험생들을 대상으로 합격수기 심사, 전화인터뷰 등의 절차를 거쳐 제13기 목표달성 장학생을 최종 선발할 계획이다.또 4월30일까지 제13기 목표달성 장학생에 도전한 수험생 전원에게 2016 장학생 합격수기집과 바른노트를 무료로 증정한다.cynical73@fnnews.com 김병덕 기자    ※ 저작권자 ⓒ   파이낸셜뉴스. 무단 전재-재배포 금지",https://news.naver.com/main/read.nhn?mode=LSD&mid=sec&sid1=102&oid=014&aid=0003624591
입학금은 대학 쌈짓돈?..산정 근거·사용처 불분명 : 네이버 뉴스,2016.02.22,edaily,"- 정보공개청구에 대학들 '나 몰라라'..- 산정 기준 마련 등 고등교육법 개정 필요청년참여연대 회원과 대학생들이 22일 서울 고려대 정문 앞에서 개최한 ‘전국 34개 대학 입학금 정보공개청구 결과발표’ 기자회견에서 입학금 산정과 집행 기준 마련을 촉구하고 있다. 박경훈 기자[이데일리 이성기 박경훈 기자] 전국 주요 대학들이 명확한 산정 기준 없이 입학금을 거둬 학교 예산으로 운용하고 있는 것으로 나타났다. 이에 따라 입학금을 실비에 근거해 산정하고 집행할 수 있도록 하는 지침을 마련해야 한다는 지적이 나온다. 참여연대 부설기관인 청년참여연대는 22일 오후 서울 고려대 안암캠퍼스 앞에서 ‘전국 34개 대학 입학금 정보공개청구 결과 발표’ 기자회견을 열고 “대학들이 뚜렷한 산정 근거 없이 입학금을 불투명하게 사용하고 있다”며 국회에 고등교육법 개정을 촉구했다. 현행 고등교육법 11조 1항에는 ‘학교의 설립자, 경영자는 수업료와 그 밖의 납부금을 받을 수 있다’고 돼 있다. 이렇다 보니 대학들은 ‘그 밖의 납부금’에 입학금을 포함해 별도의 산정기준이나 회계 처리 없이 주먹구구식으로 사용하고 있는 실정이다. 청년참여연대가 지난달 전국 4년제 대학 중 입학금 상위 23개 사립대와 9개 국공립대 등 총 34개 대학을 대상으로 정보공개청구를 한 결과 대부분의 대학들이 뚜렷한 산정 기준 없이 입학금을 책정하는 것으로 나타났다. 청년참여연대는 “최고 100만원대에 달하는 등 입학금이 등록금의 3분의 1수준이지만 산정 근거를 밝히는 대학은 거의 없었다”고 지적했다. 고려대가 103만원으로 입학금이 가장 많았고 동국대 102만 4000원, 한국외국어대 99만 8000원, 홍익대 99만 6000원 등의 순이었다. 고려대와 건국대, 덕성여대 등 6곳은 정보공개 청구에 아예 응하지 않았다. 나머지 28곳 중 ‘경영상의 비밀’을 이유로 입학금 산정 기준을 밝히지 않은 동국대와 울산과학기술대를 제외한 26곳은 입학금 산정 기준 자료가 없었다. 청년참여연대는 “대학들이 입학금을 교직원 인건비와 학생복리비, 시설비, 심지어는 자산 매입에 사용하고 있어 대학생과 학부모의 부담이 가중되고 있다”고 지적했다. 이어 “교육부가 입학금 산정·집행 세부 지침을 마련해 대학에 내려보내야 한다”고 촉구했다. 박경훈 (view@edaily.co.kr)▶ [데일리 포커스] 알면 알수록 빠져드는 경제뉴스 ▶핫 초이스 ★ 男心 저격수 `애플힙` 그녀 ＜ⓒ종합 경제정보 미디어 이데일리 - 무단전재 & 재배포 금지＞",https://news.naver.com/main/read.nhn?mode=LSD&mid=sec&sid1=102&oid=018&aid=0003483369
'우리 아이 대입전형은…' : 네이버 뉴스,2016.04.14,연합뉴스,"(서울=연합뉴스) 진연수 기자 = 14일 오후 서울 서초구 서울교육연수원에서 열린 '2016 자녀와의 소통을 위한 중등 학부모 아카데미'에서 학부모들이 학생부 종합전형과 2017 대입전형에 대한 강연을 듣고 있다. 2016.4.14    jin90@yna.co.kr▶ [핫클릭] ""국회의원 당선인 떨고 있니?""…300명중 98명 '수사중'▶ [핫클릭] 4세 아들과 2주간 롤러스케이터로 국도 달린 中아빠 논란▶ [현장영상] 전신 마비 청년, 뇌에 심은 센서로 '손' 움직이다<저작권자(c) 연합뉴스, 무단 전재-재배포 금지>",https://news.naver.com/main/read.nhn?mode=LSD&mid=sec&sid1=102&oid=001&aid=0008334295
"진학사, 입시상담 전문가 과정 모집 : 네이버 뉴스",2016.02.09,financial news,"입시전문 교육기업 진학사는 2017학년도 입시 상황에 맞춰 정확하고 명쾌한 입시전략을 제시할 수 있는 입시전문가를 양성하는 '진학사 입시상담 전문가 기본/중급 양성과정' 수강생을 모집한다.이번에 첫 개설된 기본 과정은 처음 접하는 사람도 입시의 전반적인 흐름을 잡을 수 있는 교육과정이다. 입시용어와 입시제도, 학생부, 수시와 정시의 특징 등이 다뤄지며, 진학사 입시전략연구소의 이창선 연구원이 주 강사로 나선다.중급 과정은 2017학년도 입시 상황에 맞춰 컨설팅의 이해부터 올해 입시의 특징, 사례로 다루는 수시, 정시 전략 등 입시에 대한 실제적인 지도가 가능하도록 구성된 교육과정으로 진학사 입시전략연구소 우연철 연구원, 허철 연구원이 주강사로 나선다.기본 과정은 2월 23일부터 매주 화요일마다 3주간(3/1 휴강)진행되며, 중급과정은 2월 24일부터 매주 수요일마다 5주간 진행된다. 진학사 홈페이지(www.jinhak.com)에서 강의 시작일 하루 전까지 선착순으로 신청을 받는다.진학사 본사 1층 교육장(서울 광화문)에서 진행되는 이번 과정은 상담 관계자, 학원 선생님 등 입시에 관심 있는 자라면 누구나 신청할 수 있다. (문의: 1544-7715)cynical73@fnnews.com 김병덕 기자    ※ 저작권자 ⓒ   파이낸셜뉴스. 무단 전재-재배포 금지",https://news.naver.com/main/read.nhn?mode=LSD&mid=sec&sid1=102&oid=014&aid=0003597660
백석예술대 실용음악 보컬전공 입시경쟁률 216대1 : 네이버 뉴스,2016.01.29,서울신문,"[서울신문]백석예술대학교 음악학부 실용음악전공 2016학년도 정시 1차 보컬전공 입학전형에서 1295명 지원자가 응시해 216대1이라는 놀라운 경쟁률을 기록했다. 그 밖에 건반(171대1), 기타(141대1), 작∙편곡 및 컴퓨터음악(136대1), 뮤직테크놀로지(114대1), 싱어송라이터(103대1) 등 총 7개 전공에서 100대1 넘는 경쟁률을 기록했다.백석예술대 실용음악전공 소속 재학생들은 매 학기 정기음악회를 실시해 수업 중 습득한 다양한 음악적 재능을 일반대중들에게 선보이고 있다. 현대음악산업은 일반인들의 접근성 향상에 힘입어 과거에 비해 확고한 대중적 기반을 갖춰가고 있다. 이러한 시대적 흐름은 전문음악인들에게 진취적인 예술관뿐만 아니라 탁월한 실무능력까지 요구하고 있다.백석예술대 음악학부 실용음악전공은 시대가 요구하는 전문실용음악인을 양성하기 위해 대중음악의 학문적인 체계를 구축했다. 더불어 현장과 동일한 환경에서 학생들이 간접적으로 공연상황을 체험할 수 있도록 첨단장비와 시스템을 구비하여 활용하고 있으며, 이론과 실기 그리고 실무를 완벽하게 소화하여 실용음악 제반업계로 진출할 수 있는 미래의 예술전문가 양성을 목표로 하고 있다.백석예술대 실용음악전공은 보컬트랙, 기악트랙, 작곡트랙으로 나뉘어 있으며 세부전공으로 보컬, 건반, 기타, 베이스기타, 드럼, 관악기, 작∙편곡, 싱어송라이터, 뮤직테크놀로지 등을 두어 전문 음악인으로서 요구되는 기술과 능력을 교육받고 있다.이러한 노력결과 2014년에는 실용음악 분야에서는 세계 최고의 명문 교육기관으로 인정받고 있는 미국 버클리음악대학과 교류 협력을 체결했다. 그리고 2014유재하가요제에서 본교 이신영 학생(당시 2학년)이 자신의 창작곡 ‘그 때 그 마음으로’ 가 대상을 차지하는 쾌거를 이뤘다.백석예술대 실용음악 소속 교원들은 학생들이 양질의 교육은 물론 음악전문인으로 성장할 수 있도록 최선을 다하고 있다. 학생들 또한 백석예술대학교 실용음악전공의 수준 높은 교육과정을 통해 자신만의 개성있는 음악적 커리어를 형성하기 위해 끊이없이 노력을 기울이고 있다.이명선 전문기자 mslee@seoul.co.kr ▶ 부담없이 즐기는 서울신문 ‘최신만화’  - 저작권자 ⓒ 서울신문사 -",https://news.naver.com/main/read.nhn?mode=LSD&mid=sec&sid1=102&oid=081&aid=0002675005
통로까지 가득 채운 입시열기 : 네이버 뉴스,2016.04.02,연합뉴스,"(서울=연합뉴스) 김도훈 기자 = 2일 오후 2017학년도 고려대학교 입시 설명회가 열린 서울 성북구 고려대학교 화정체육관이    학부모들로 붐비고 있다. 2016.4.2    superdoo82@yna.co.kr▶ [핫클릭] '불사신' 휴대전화…'태후'의 상상초월 황당 신은?▶ [핫클릭] 美명문사립고 성추문에 '발칵'…""교사가 학생과 수개월 성관계""▶ [영상] '셀카 찍고 목욕하고'…자이언트 판다의 재롱<저작권자(c) 연합뉴스, 무단 전재-재배포 금지>",https://news.naver.com/main/read.nhn?mode=LSD&mid=sec&sid1=102&oid=001&aid=0008301351
"'마리텔' 한예리, 입시 증명사진 공개 ""내 흑역사, 볼살 안 빠지더라"" : 네이버 뉴스",2016.01.17,세계닷컴,"'마리텔' 한예리, 입시 증명사진 공개 ""내 흑역사, 볼살 안 빠지더라""배우 한예리가 MBC ‘마이 리틀 텔레비전’에 출연 중이다.한예리는 17일 다음 TV팟을 통해 생중계로 진행된 MBC ‘마이 리틀 텔레비전’ MLT-20에 출연해 어린 시절 사진을 공개했다.이날 한예리는 학창시절을 공개하던 중 입시를 준비하며 찍은 증명사진을 공개하며 “흑역사”라고 소개했다. 그는 “선생님이 매일 다이어트 하라고 했다. 아무리 다이어트를 해도 볼살만 안 빠졌다”며 “아무리 살을 빼도 볼살은 안 되더라”고 말해 눈길을 사로잡았다.한편 한예리는  배우로 데뷔하기 전 한국예술종합학교 전통예술원에서 한국무용을 전공한 예술인이다. 이슈팀  ent1@segye.com ⓒ 세상을 보는 눈, 글로벌 미디어 세계일보",https://news.naver.com/main/read.nhn?mode=LSD&mid=sec&sid1=102&oid=022&aid=0002997163
"[손안의 입시] 연세대, 고2 치루는 2018학년도 입시서 학생부전형 50% 대폭 확대 : 네이버 뉴스",2016.03.29,헤럴드경제,"[헤럴드경제=박세환 기자] 연세대가 고교 2학년생이 치루는 2018학년도 입시에서 학생부종합전형을 대폭 확대하기로 했다.연세대는 29일 학생부종합전형 모집인원을 2017학년도 681명에서 1019명으로 49.6% 늘리는 등 내용을 담은 2018학년도 입시안을 확정해 발표했다.연세대는 기계적으로 산출되는 성적의 높낮이로 학생을 평가하는 학생부교과전형은 폐지하기로 했다.연세대는 “정량적 지표 위주의 평가를 지양하고 미래 인재로서의 성장 잠재력을 갖춘 인재를 선발하기 위해 학생부종합전형을 확대한다”고 설명했다.특기자전형은 인문학인재ㆍ사회과학인재계열 모집인원을 축소하기로 했다. 이들계열은 이후로도 점진적으로 축소돼 2020학년도 입시부터 모집이 전면 중지된다.수능 영어의 절대평가 전환에 따라 정시에서의 등급 환산 방식도 바뀌었다. 당락에 실제 영향을 줄 가능성이 큰 1·2등급간 격차는 5점이며, 2·3등급간 격차는 7.5점, 3·4등급간 격차는 12.5점 등이다.이 입시안은 한국대학교육협의회 승인을 거쳐 2018학년도 입학전형 계획으로 확정된다.greg@heraldcorp.com▶ 안철수 “박대통령 70년대 사고방식, 유승민은 개혁보수 상짹,▶ 대만 4세 여아 길거리 참수…대만사회 ‘충격’▶ 박대통령 전속 사진사가 소환됐다는데, 그 이유가?[글로벌 인재들의 필수 역량, SKEC 영어글쓰기대회] [주니어 영어 신문의 가장 효율적인 학습 서비스][헤럴드경제] [SUPERICH] [REAL FOODS] [헤럴드증권방송] [HOOC]- Copyrights ⓒ 헤럴드경제 & heraldbiz.com, 무단 전재 및 재배포 금지 -",https://news.naver.com/main/read.nhn?mode=LSD&mid=sec&sid1=102&oid=016&aid=0001022087
수성구 창의적체험활동 지원센터 '학부모를 위한 입시 토크' : 네이버 뉴스,2016.01.17,매일신문,"대구 수성구청은 20일과 21일 중학교와 고등학교 진로`진학과 관련된 맞춤식 교육 프로그램 '학부모를 위한 입시 토크, 무엇이든 물어 보세요'를 진행한다. 중`고교생 자녀를 둔 학부모 40명 안팎을 대상으로 한다. 자녀의 진로 설정 및 전공 선택, 입시 준비를 위한 개인별 학습전략 등에 대해 토크쇼 형태로 진행한다. 강의는 매일신문교육문화센터 김기영 연구실장이 맡으며 참석자를 대상으로 개인별 상담도 마련할 예정이다. 중학생 학부모 대상은 20일(수) 오전 10시부터, 고교생 학부모 대상은 21일(목) 오전 10시부터 범어도서관 5층 대강당에서 열린다. 선착순 모집으로 신청 및 문의는 수성구청 창의적체험활동 지원센터(053-756-9112)로 하면 된다.이석수 기자 sslee@msnet.co.krⓒ매일신문 - www.imaeil.com",https://news.naver.com/main/read.nhn?mode=LSD&mid=sec&sid1=102&oid=088&aid=0000428014
대입 공부만이 살길이다 : 네이버 뉴스,2016.01.22,뉴시스,"【대구=뉴시스】추상철 기자 =2017학년도 수시전형을 대비한 제6회 수시캠프가 열린 22일 오후 대구 달서구 계명대학교에서 예비 고3학생들이 명문대 재학생인 멘토와 함께 대입 전략 등에 대한 상담을 받고 있다. 1박2일간 진행되는 수시캠프에는 예비 고3 159명이 참가해 개별면접관, 수시상담관, 멘토-멘티관, 대입을 위한 토크콘서트 등의 프로그램에 참여한다. 2016.01.22. scchoo@newsis.com★ 세상에 이런일이 -  1주일에 1명…정자 판매해 자녀가 800명 ★ 오늘의 핫 포토 -  이하늬, 안 입은 줄…파격 착시 드레스 [사진 영상 제보받습니다] 공감언론 뉴시스가 독자 여러분의 소중한 제보를 기다립니다. 뉴스 가치나 화제성이 있다고 판단되는 사진 또는 영상을 뉴시스 사진영상부(n-photo@newsis.com, 02-721-7470)로 보내주시면 적극 반영하겠습니다.<저작권자ⓒ 공감언론 뉴시스통신사. 무단전재-재배포 금지.>",https://news.naver.com/main/read.nhn?mode=LSD&mid=sec&sid1=102&oid=003&aid=0007000670
베이징시 2020년 대입 문·이과 통폐합 : 네이버 뉴스,2016.04.08,YTN,"중국이 현행 문과·이과 구분을 폐지하고 학생 선택권을 확대하는 쪽으로 대입제도 개혁을 추진합니다.   베이징시는 2020학년도 대학 입시부터 문과, 이과 구분을 없애고 '3+3'의 과목 선택제를 도입한다고 중국 신경보가 보도했습니다.   '3+3' 제도는 중국어와 수학, 외국어 등 필수 3과목과 사상정치, 역사, 지리, 물리, 화학, 생물 등 6개 선택과목 중 3과목을 선택해 시험을 치르는 제도입니다.   수도이자 명문대가 몰린 베이징시가 공식적으로 문·이과 폐지를 선언함에 따라 나머지 지방의 입시제도 개혁안에도 상당한 영향을 줄 것으로 전망됩니다.   최근 중국 31개 성·시 ·자치구 가운데 16개 지역이 내놓은 대입제도 개선안에는 문·이과 구분 폐지가 포함될 정도로 대세가 되고 있다고 중국 언론들은 전했습니다.  ▶ [영상] 콘크리트 바닥에 여고생 '패대기'친 경찰  ▶ [한컷뉴스] 화장실 청소하던 주부 사망 미스터리   [저작권자(c) YTN & YTN PLUS. 무단 전재-재배포 금지]",https://news.naver.com/main/read.nhn?mode=LSD&mid=sec&sid1=104&oid=052&aid=0000814717
[사설]금수저의 로스쿨 입시 비리 뿌리 뽑아야 : 네이버 뉴스,2016.03.30,media KHAN,"‘금수저’ 논란의 법학전문대학원(로스쿨)이 입시 비리 의혹에 휩싸였다. 신평 경북대 로스쿨 교수는 최근 발간한 저서 <로스쿨 교수를 위한 로스쿨>에서 입시 부정의혹을 제기했다. ‘사법시험 존치를 위한 고시생 모임’은 대구지방경찰청에 이에 대한 수사를 의뢰했다. 신 교수는 “한 로스쿨 교수가, 아는 변호사의 자녀를 입학시키기 위해 동료교수들에게 청탁하고 다녔다”고 폭로했다. 자신도 정치인과 법조인, 교수들로부터 수많은 청탁 전화를 받았다고 밝혔다. 자기소개서에 고위층인 아버지 이름을 쓰거나, 면접에서 대놓고 아버지 이름을 거론하는 수험생도 있다고 한다. 모두 로스쿨 입시의 공정성을 흔드는 일이다. 비단 경북대만의 일은 아닐 것이다. 법조인을 양성하는 로스쿨 입시의 공정성은 로스쿨 제도의 정당성은 물론 법조계 전체의 신뢰와 직결되는 중요한 문제이다. 로스쿨은 과도한 학비로 진입장벽을 쌓고 있다는 지탄을 받고 있다. 여기에 입시 부정까지 확인된다면 존폐 논란을 피할 수 없을 것이다. 철저한 진상규명을 통해 입시비리를 뿌리 뽑아야 한다.   교육부는 지난 1월 말까지 25개 로스쿨 전체의 입학 과정을 전수조사한 자료를 갖고 있다. 그런데 이를 총선 이후에나 발표할 것이라고 한다. 왜 그래야 하는지 이유를 알 수 없다. 고위층과 정치인이 연루되거나 충격적인 내용이 많아 수위 조절하려 한다는 말도 돈다. 교육부는 공연한 오해를 사지 말고 가급적 빨리 자료를 공개해야 한다. 이번 사태를 로스쿨이 거듭나는 기회로 삼을 필요가 있다. ▶ 인기만화, 웹툰 전권 무료만화 보기 모바일 경향 [경향 뉴스진 | 경향신문 앱 | 모바일웹] | 공식 SNS 계정 [경향 트위터] [페이스북] [세상과 경향의 소통 커뮤니티]- ⓒ 경향신문(www.khan.co.kr), 무단전재 및 재배포 금지〈경향신문은 한국온라인신문협회(www.kona.or.kr)의 디지털뉴스이용규칙에 따른 저작권을 행사합니다.〉",https://news.naver.com/main/read.nhn?mode=LSD&mid=sec&sid1=110&oid=032&aid=0002687797
