title,date,press,contents,link
"서울교육청, 자사고·특목고 입시 사교육부담 점검 : 네이버 뉴스",2016.03.20,연합뉴스,"수험생 [연합뉴스TV 제공] 자사고·특목고 입시로 사교육 과열…27개교 대상 영향평가     (서울=연합뉴스) 김용래 기자 = 서울의 과학고·특수목적고·자율형사립고 등 자기주도학습전형으로 신입생을 뽑는 고교들을 대상으로 사교육 영향 평가가 진행된다.     서울시교육청은 20일 서울의 특목고 9개교, 자사고 18개교 등 27개 학교를 대상으로 고입전형 영향평가를 진행하고 있다고 밝혔다.    고입전형 영향평가는 외국어고와 과학고 등의 특목고와 자사고, 국제고 등 서류평가와 면접 등 '자기주도학습전형'으로 학생을 선발하는 학교들의 입시 전형이 사교육열을 부추긴다는 지적에 따라 2010년부터 실시되고 있다.    심사 대상학교는 과학고 2곳, 외고 6곳, 국제고 1곳, 자사고 18곳 등 자기주도학습전형으로 전기에서 학생을 선발하는 27개 고등학교다. 작년에는 총 34개교를 대상으로 영향평가를 했지만, 이번에는 입학전형에서 면접이 포함되지 않은 자사고들을 대상에서 제외했다.        교육청은 이들 학교의 입학 전형에서 정규 학교교육 외의 교육 수요를 유발하는지를 중점 점검하고, 개별학교가 제출한 자율평가 보고서를 바탕으로 교육과정 정상화 심의위원회를 열어 사교육 유발 정도를 살필 계획이다.    특히 각종 경시대회 입상경력, 인증시험, 자격증 취득 등 이른바 '스펙'을 평가하는지와, 교과 지식을 묻는 형태의 구술면접이나 적성검사를 시행하는지를 중점적으로 살필 방침이다.    또 엄격히 금지된 학부모의 사회경제적 지위에 대한 질문 여부나 중학교 교육과정을 뛰어넘는 입학전형을 하는지도 집중 점검 대상이다.      학부모와 교사 등 내외부 인사들로 구성된 심의위원회가 분석한 사교육 부담 요인 심사 결과는 교육감에게 보고된다.    교육청은 정상적인 교육 과정을 벗어나 과도한 사교육 경쟁을 유발한 것으로 판단된 학교들에 대해 기관 경고 등 주의 조치와 시정 요구를 할 방침이다.    이런 개선요구를 입학전형에 반영하지 않는 학교는 향후 교육청의 자사고·특목고 운영성과 평가에서 불이익을 받게 된다.    지난해 고교 입학전형 영향평가에서는 일부 자사고·특목고들이 교육청에서 파견한 면접 위원에게 평가 영역을 제한적으로 부여하는 등 평가의 공정성을 훼손하는 일이 적발되기도 했다고 교육청은 설명했다.     교육청 관계자는 ""특목고·자사고 등에 입학시키기 위해 학부모들이 자녀가 초등학생 때부터 과도한 선행학습을 시키는 등 사교육 부담이 커지고 있다는 지적이 계속되고 있다""며 ""이들 학교의 입시전형에서 사교육 유발 요인이 없는지 철저히 점검·지도할 방침""이라고 말했다.    yonglae@yna.co.kr▶ [핫클릭] ""바지에 소변 봐 욕조에 두었더니 숨져""…4살배기 딸 암매장▶ [핫클릭] JYP ""원더걸스 유빈 악성 루머 사실무근…법적 대응""▶ [현장영상] 가짜 신분증·명함으로 위장한 보이스피싱<저작권자(c) 연합뉴스, 무단 전재-재배포 금지>",https://news.naver.com/main/read.nhn?mode=LSD&mid=sec&sid1=102&oid=001&aid=0008266348
용산아트홀 가득채운 입시 열기 : 네이버 뉴스,2016.03.30,뉴시스,"【서울=뉴시스】김선웅 기자 = 30일 오후 서울 용산구 용산아트홀 대강당에서 열린 2017학년도 용산구 대학입시설명회에서 참석 학생과 학부모들이 수시모집 전형별 지원 준비 방법 및 전략에 대한 설명을 듣고 있다. 2016.03.30.  mangusta@newsis.com★ 세상에 이런일이 -  ""성매매 처벌 무서워""…3층서 투신한 女 불구속 ★ 오늘의 핫 포토 -  걸 그룹 외모 뺨치는 무소속 유승민 후보 딸 [사진 영상 제보받습니다] 공감언론 뉴시스가 독자 여러분의 소중한 제보를 기다립니다. 뉴스 가치나 화제성이 있다고 판단되는 사진 또는 영상을 뉴시스 사진영상부(n-photo@newsis.com, 02-721-7470)로 보내주시면 적극 반영하겠습니다.<저작권자ⓒ 공감언론 뉴시스통신사. 무단전재-재배포 금지.>",https://news.naver.com/main/read.nhn?mode=LSD&mid=sec&sid1=102&oid=003&aid=0007133228
내년 대입 최대 관건은 내신·심층면접 : 네이버 뉴스,2016.03.31,국민일보,"2018학년도 주요 대학 입학전형에서 영어 비중이 줄고 예년에 비해 수학, 탐구 등이 더 중요해진다. 2017년 치르는 대학수학능력시험부터 영어가 절대평가로 바뀌면서 변별력이 축소되기 때문이다. 수시모집이 확대되면서 정시와 수능보다는 내신과 면접이 합격의 열쇠가 된다. 입시전문가들은 영어에 강한 외국어고 국제고 등 학생들이 영어 반영 비중이 상대적으로 낮은 대학을 기피할 수 있다고 내다봤다. 임성호 종로학원 하늘교육 대표는 31일 “주요 대학이 공통적으로 영어를 포함해 수능 자체로 변별력을 가르지는 않겠다는 흐름”이라며 “반대급부로 수시전형과 내신 영향이 커지는데 지원자 간 내신 차이가 크지 않아 심층면접과 비(非)교과 평가가 강화되는 양상”이라고 분석했다. 서울대는 정시에서 영어 비중을 사실상 ‘무력화’했다. 2등급부터 0.5점씩 감점한다. 100점으로 1등급을 받아도 80점을 맞은 2등급과 0.5점 차이밖에 나지 않아 변별력이 사라지는 것이다. 자연계열은 과학탐구가 중요해졌다. 정시 일반전형에서 과학탐구 과목 2개를 모두 Ⅱ형으로 응시한 지원자에게 가산점을 부여한다. 서울대 수시 지역균형선발의 경우 영어 절대평가 영향으로 수능 최저학력기준이 완화된다. 국어 수학 영어 탐구 가운데 3개 영역 이상에서 2등급 이내여야 하는데 영어 2등급 확보가 쉬워지기 때문이다. 대신 비교과와 심층면접 비중이 커진다. 특히 심층면접 문제를 풀어보는 시간을 30분에서 45분으로 늘려 면접 난이도를 높였다는 분석이 나온다. 연세대는 수시 학생부종합전형의 모집인원을 681명에서 2018학년도 1019명으로 50% 가까이 늘렸다. 수능 최저학력기준이 없는 면접형 학생부종합전형을 신설하고 내신으로 평가하던 학생부교과전형은 폐지했다. 심층면접의 중요성이 커진 셈이다. 수시 일반전형의 수능 최저학력기준은 소폭 완화됐지만 탐구영역은 적용과목이 하나에서 둘로 늘어 변별력이 높아졌다. 정시에서 영어 1등급과 2등급 간 점수 차가 5점으로 이화여대(10점) 다음으로 커서 변별력이 상대적으로 높은 편이다. 고려대는 정시 선발인원이 25%에서 15%로 줄어 수능에 강한 재수생, 특목고생에게 불리할 수 있다. 수능 90%, 학생부 10%로 선발하던 정시는 수능으로만 뽑는다. 정시에서 영어 2등급은 1점, 3등급 이하는 등급별로 2점씩 깎는다. 연세대보다 등급 간 차이가 적다. 수시에선 학생부종합전형이 대폭 확대되고 고교추천전형의 학교당 추천 인원이 재학생의 4%로 늘어 내신뿐 아니라 비교과 영역, 면접이 중요해진다. 논술은 폐지되고 면접 비중이 높아진다. 서강대는 정원 내 선발인원의 80%에 이르는 1283명을 수시로 뽑는다. 수능 최저학력기준이 적용되는 수시에선 영어가 수능 최저학력기준에 포함되고 인문·자연계열 교차 지원도 허용돼 경쟁률이 높아질 전망이다. 내신, 비교과 영역, 면접, 논술 등에 무게가 더해질 수밖에 없다. 서강대는 정시에 수능 영어 성적을 반영할 때 등급당 1점을 깎아 변별력이 적다. 성균관대는 정시에 영어를 아예 반영하지 않는다. 정시 인문계열은 수학(40%) 국어(40%) 사회·과학탐구(20%) 순으로, 자연계열은 수학(40%) 과학탐구(35%) 국어(25%) 순으로 중점을 뒀다. 수시 전형은 76.0%에서 80.3%까지 확대하고 학생부 전형을 283명 늘렸다. 논술 위주 전형은 153명 줄였다.전수민 기자 suminism@kmib.co.krGoodNews paper ⓒ 국민일보(www.kmib.co.kr), 무단전재 및 재배포금지[뉴스 미란다 원칙] 취재원과 독자에게는 국민일보에 자유로이 접근할 권리와 반론·정정·추후 보도를 청구할 권리가 있습니다. 고충처리인(gochung@kmib.co.kr)/전화:02-781-9711",https://news.naver.com/main/read.nhn?mode=LSD&mid=sec&sid1=102&oid=005&aid=0000885024
25일 구미옥계 외대어학원 주최 ‘외대부고 졸업생 멘토에게 듣는 특목입시 이야기’ 강연 : 네이버 뉴스,2016.02.19,뉴스1,"© News1(서울=뉴스1Issue) 김남희 기자 = 62년 영어교육 전통의 한국외대가 만든 구미 옥계 외대어학원에서는 특목, 자사고 입시에 관심 있는 학부모를 위해 ‘외대부고 졸업생 멘토에게 듣는 특목입시 이야기'라는 주제로 강연을 개최한다. 설명회 일시는 2월 25일 목요일 오전 11시이며, 장소는 구미 근로자문화센터 시청각실이다. 예약은 구미 옥계 외대어학원으로 연락하면 된다. ◇ 2016학년도 서울대 입시에서 전국 1위 합격자수를 배출한 용인외대부고의 저력용인에 위치한 외대부고는 한국외대를 운영하는 동원육영회가 운영하는 전국단위 자사고로서 16학년도 서울대 입시에서 수시 44명, 정시 32명 등 총 76명의 합격자를 배출해 서울대 합격자 수 전국 1위 학교가 되었다. 그뿐만 아니라 작년과 재작년에는 하버드 3명과 예일 4명이 합격하는 등, 아이비리그 등 해외 명문대 진학에도 뛰어난 성과를 이루었다.외대부고는 뛰어난 입시실적 외에도, 학생들의 만족도가 높은 학교로도 알려져 있다. 실제 학생 만족도 전국 1위(EBS 조사), 학부모 선호도 전국 1위(사교육업체 조사)를 기록하는 학교다. 그 이유는 신의급식으로 유명한 학교 급식과 고 앙드레김이 디자인한 교복, 2인 1실의 첨단 기숙사 등 ‘행복한 학교’를 지향하는 외대부고의 교육철학과 시스템 때문이기도 하다.◇ 구미 학부모에게 외대부고 졸업생의 공부노하우나 학교생활을 생생하게 전달하는 것이 목적 김지원 외대어학원 원장은 ""구미 지역에서 외대부고에 진학하는 학생이 많지 않지만, 이번에 특강을 진행하는 가장 큰 이유는 학부모들에게 외대부고를 졸업한 학생이 바라보는 외대부고 생활과 공부 노하우에 대한 생생한 목소리를 직접 듣게 해서 외대부고 등 자사, 특목고에 진학하는 것이 자녀에게 어떤 장점이 있는지 학부모가 아는 것이 필요하다""고 밝히고 있다. 이번에 특강을 해줄 외대부고 졸업생은 장석윤 멘토로 대원 국제중학교를 졸업하고, 외대부고 국제과정을 마치고, 해외명문대학에 진학 예정이다.설명회에서는 장석윤 멘토가 외대부고에 재학했던 경험을 바탕으로, '외대부고 졸업생이 바라본 특목, 자사고에 진학해야 하는 이유' '중학교에서 비교과 준비 및 교내외 활동' '나의 자기소개서 작성 및 면접 준비 노하우' '초, 중 시절 영·수 학습법과 내신대비법' '나의 용인외대부고 생활(비교과 중심으로)' 등의 주제에 대해서 이야기하고 마지막으로 '학부모와의 질의, 응답' 등의 순서로 진행할 예정이다. ◇ 대학 수시와 비슷한 특목·자사고 준비는 미리 대입을 경험해 본다는 장점구미 영어학원인 구미 옥계 외대어학원 박상희 원장은 ""학생들에게 구미 지역 학생들과 학부모들이 특목·자사고 준비에 관심을 가져야 하는 이유는 단지 특목고, 자사고 진학 목표가 아니다""고 이야기한다. 또 ""서울대, 연세대, 고려대 등 상위권 대학 대부분이 수시 입시 비중이 큰데, 수시는 특목·자사고 입시 준비와 매우 흡사하기 때문에 설령 원하는 고등학교에 입학하지 못한다 하더라도, 한 번 미리 대학입시를 체험해 볼 수 있고 이는 나중을 위해서 큰 장점이 있다""고 이야기한다. 또한 ""실제로 특목·자사고의 상위권 대학 진학률이 높기 때문에 충분히 관심을 갖고 체계적인 준비과정을 통해 도전해 볼 가치가 있다""고 강조한다. 참고로 분당 외대어학원 본원에서는 올해 30명의 외대부고 합격자를 배출했고 지난 7년 동안 282명이 진학을 했다. 구미 옥계 외대어학원에서는 앞으로도 지속적으로 특목·자사고 입시와 관련해서 학부모들에게 양질의 신뢰성 있는 정보를 제공하겠다고 밝혔다. 옥계 김지원 원장은 ""이번 설명회를 통해서 학부모들이 이 과정을 통해서 학부모들이 특목·자사고에 관심을 가지고, 도전까지 해 볼 수 있는 계기가 되었으면 좋겠다""고 밝혔다.ebiz@▶ [뉴스1글로벌] 가장 빠른 세계 경제 서비스 오픈!!▶ 뉴스1 100% 무료 만화 서비스 오픈!![© 뉴스1코리아(news1.kr), 무단 전재 및 재배포 금지]",https://news.naver.com/main/read.nhn?mode=LSD&mid=sec&sid1=102&oid=421&aid=0001898359
"""우리는 제3대학 입학생입니다"" : 네이버 뉴스",2016.03.08,뉴시스,"【울산=뉴시스】구미현 기자 = 8일 울산 북구청 대회의실에서 제3대학 입학식이 열린 가운데 학장인 박천동 북구청장과 내빈, 신입생 등이 단체사진을 찍고 있다. 2016.03.08. (사진=울산시 북구 제공) photo@newsis.com★ 세상에 이런일이 -  데이트폭력 조사중 ´스폰서 관계´ 실토한 여배우 ★ 오늘의 핫 포토 -  누드 동영상 유출 파문 재판 출석한 스포츠 아나운서 [사진 영상 제보받습니다] 공감언론 뉴시스가 독자 여러분의 소중한 제보를 기다립니다. 뉴스 가치나 화제성이 있다고 판단되는 사진 또는 영상을 뉴시스 사진영상부(n-photo@newsis.com, 02-721-7470)로 보내주시면 적극 반영하겠습니다.<저작권자ⓒ 공감언론 뉴시스통신사. 무단전재-재배포 금지.>",https://news.naver.com/main/read.nhn?mode=LSD&mid=sec&sid1=102&oid=003&aid=0007085035
[시린 봄날의 청춘]① 먹고대학생? 입학과 동시 스펙쌓기 : 네이버 뉴스,2016.03.08,아시아경제신문,"취준생 사자성어 노이무공 뜻처럼 무기력함이 느껴지는 취준생 / 사진=아시아경제 DB[아시아경제 김동선 기자, 문제원 수습기자, 권재희 수습기자]'이태백(20대 태반이 백수)'·'인구론(인문계 졸업생 90%가 미취업)' 등의 신조어가 예사말이 아닌 현실에서 갓 대학에 입학한 신입생들이 일찌감치 취업 전선에 뛰어들 채비를 하고 있다. 이들에게 캠퍼스의 낭만은 사치에 불과하고 '먹고대학생'이라는 말은 전설이나 다름없다. 이제 막 '봄날'을 맞은 청춘들에게 현실은 그저 시리기만 하다.대학 신입생이 된 이의진(20ㆍ서강대)씨는 수능이 끝난 지 한 달 만에 토플 공부를 시작했다. 고등학교를 졸업하기도 전이었지만 대학에 들어가면 해외 교환학생을 가려고 미리 준비한 것이었다. 그는 ""아직은 막연하지만 요즘 취업이 힘들다는 얘기가 많아서 미리 교환학생 준비와 자격증 공부를 하고 있다""고 말했다.입시가 끝나고 한숨 돌릴 수 있을 줄 알았던 신입생들이 대학교에 진학하자마자 다시 '경쟁'에 내몰리고 있다. 과거 대학 고학년에게만 해당됐던 '스펙 경쟁'이 저학년을 지나 신입생에게까지 번진 것이다. 통계청에 따르면 1월 청년실업률은 9.5%로 2000년이후 최고치를 기록하는 등 갈수록 청년 구직난은 심각한 상황이다. 서강대학교 취업지원팀 관계자는 ""저학년 때부터 진로 준비를 하면 좋겠다는 생각에 신입생들이 찾아와 취업 상담을 많이 받는다""고 귀띔했다.학점이나 어학점수 등 기본적인 스펙은 신입생 때부터 미리 관리해야 하는 항목이 된지 오래다. 서동주(20ㆍ서강대)씨는 ""시간표를 짤 때 듣고 싶은 수업보다는 학점을 잘 받을 수 있는 과목으로 신청했다""며 ""선배들에게 물어보거나 학교 커뮤니티 사이트에 들어가면 학점 잘 주는 교수님이 누군지 알 수 있다""고 말했다. 신촌 YBM어학원 관계자는 ""대학교 안에서 하는 토익ㆍ토플 강의에는 수강자의 절반이 16학번일 만큼 신입생들의 참여가 높다""고 말했다.최근에는 기업들이 어학점수와 학점 등 기존에 중시되던 스펙뿐 아니라 개성 있는 채용 평가를 도입하면서 다양한 분야에서 스펙을 쌓으려는 학생도 늘고 있다. 계명대학교에 재학중인 김용진(22)씨는 1학년 때부터 지역 국회의원 사무실에서 인턴을 했다. 그는 ""구체적인 진로가 정해진 건 아니지만 무엇이라도 경력을 쌓아두면 취업에 도움이 될 거라고 생각한다""고 말했다. 그는 인턴 활동중 지역 신문에 단신으로 실린 기사를 모두 스크랩해 뒀다. 그는 ""취업 준비를 할 때 포트폴리오로 사용할 생각""이라고 했다.서울의 한 사립 대학교에서 홍보대사 활동을 한 박모(27)씨는 ""반드시 특정 기업에 취업하기 위한 것은 아니더라도 다른 사람이 잘 하지 않는 활동을 하면 훗날 이력서를 작성할 때나 면접을 볼 때 도움이 될 거라 생각한다""며 ""학생 홍보대사 중에도 1학년 때 지원하는 비중이 30%는 되는 것 같다""고 했다.스펙 쌓기의 저학년화는 과도한 경쟁이 원인으로 꼽힌다. 곽금주 서울대 심리학과 교수는 ""현재의 20대들은 대학 입학 전부터 경쟁적이고 목표 지향적으로 길러져왔기 때문에 스펙 압박이 심하다""고 진단했다. 그는 ""성과에 매달리는 우리나라의 전반적인 사회구조가 문제""라며 ""대학에서 자신의 인생관을 찾고 폭넓은 인간관계를 맺는 것이 취업을 할 때 더 도움이 된다는 인식이 생기도록 사회분위기가 변해야 한다""고 했다.김동선 기자 matthew@asiae.co.kr문제원 수습기자 nest2639@asiae.co.kr권재희 수습기자 jayful@asiae.co.kr▶ 주요 이슈의 재구성, 촌철살인 이미지 파일 '카드뉴스'▶ 아시아경제 제휴, 무료 민간자격증 취득 이벤트<ⓒ세계를 보는 창 경제를 보는 눈, 아시아경제 무단전재 배포금지>",https://news.naver.com/main/read.nhn?mode=LSD&mid=sec&oid=277&aid=0003702031
전북대 2018년도 입시 수시모집·학생부종합전형 확대 : 네이버 뉴스,2016.04.12,연합뉴스,"(전주=연합뉴스) 백도인 기자 = 전북대가 2018학년도 신입생 수시모집 비율을 63%로 늘린다.    올해의 51.4%에서 12% 포인트 이상 확대하는 것이다.    그동안 정시와 학생부 교과전형으로만 선발했던 의예과·치의예과·수의예과·간호학과는 학생부 종합전형으로도 선발한다.    이들 학과를 제외한 모든 학과의 수능 최저학력 기준도 폐지한다.    이와 함께 '모험 인재' 양성을 위해 수학, 영어, 과학, 소프트웨어 등의 분야에서 창의적 재능이 있거나 진취적이고 모험적인 활동이 있는 학생을 선발하는 모험·창의인재 전형도 확대한다.    최영준 전북대 입학본부장은 ""이번에 확정한 입학 전형은 고교 교육 정상화에 도움을 주고 창의적 인재에 대한 수요에 대비하기 위한 것""이라고 말했다.    doin100@yna.co.kr▶ [핫클릭] 국회의원 금배지 사실은…3만5천원짜리 '銀배지'▶ [핫클릭] 소방관 복장 아내의 모유 수유 사진 논란…남편 징계받을 듯▶ [현장영상] '도시의 닌자', 제2롯데월드 오른 영상 공개…'아찔'<저작권자(c) 연합뉴스, 무단 전재-재배포 금지>",https://news.naver.com/main/read.nhn?mode=LSD&mid=sec&sid1=102&oid=001&aid=0008326020
"나경원, 딸 대학교 부정입학 의혹에 ""정상적인 입시 절차 거쳐 합격"" 반박 : 네이버 뉴스",2016.03.18,eTimesinternet Co,"나경원  출처:/JTBC ''비정상회담'' 캡쳐나경원의 딸이 대학 부정입학 의혹을 받으며 논란의 중심에 섰다. 최근 나경원의 딸은 서울 성신여대에 특수교육대상자 전형에 통과해 현대실용음악학과에 입학했다.나경원 의원은 딸의 부정입학 의혹을 제기한 매체에 강경 대응하겠다고 밝히며 SNS를 통해 공식 입장을 발표했다.나경원 의원은 ""엄마가 정치인이라는 이유로 딸의 인생이 짓밟혔다""고 분노했다. 나경원 의원은 ‘뉴스타파’가 자신의 딸이 성신여대 수시 1차 특수교육 대상자 전형으로 합격했다는 보도에 “우리나라에서는 매년 수백명의 장애인 수험생들이 장애인 특별전형에 따라 정원 외로 대학교육의 기회를 얻고 있다. 올해에도 발달장애인 학생 두 명이 서울대학교 음악대학에 합격했다”고 말했다.또“제 아이는 정상적인 입시 절차를 거쳐 합격했다. 당시 다른 학교 입시전형에도 1차 합격한 상황에서 성신여대에 최종 합격하여 그 학교를 택했을 뿐”이라고 부정입학 의혹을 일축했다.나경원 의원은 글 말미에 ""반드시 책임을 묻겠다""고 강경 대응 할 것임을 예고했다.김현이 기자 hekim@etnews.com [Copyright ⓒ 전자신문 & 전자신문인터넷, 무단전재 및 재배포 금지]",https://news.naver.com/main/read.nhn?mode=LSD&mid=sec&sid1=100&oid=030&aid=0002461175
전남대 대입전형 핵심교사 직무연수 실시 : 네이버 뉴스,2016.01.24,아시아경제신문,"전남대학교(총장 지병문)가 고교-대학 교육 연계성 강화와 인재양성 체계를 구축하기 위해 마련한 대입전형 핵심교사 직무연수가 성황리에 마무리됐다. ""광주·전남 고교 교사 180명 참가 …학생부 위주 전형 중요성 공유"" [아시아경제 노해섭 기자]전남대학교(총장 지병문)가 고교-대학 교육 연계성 강화와 인재양성 체계를 구축하기 위해 마련한 대입전형 핵심교사 직무연수가 성황리에 마무리됐다.전남대학교는 지난 1월 11일부터 22일일까지 대학본부 1층 세미나실(광주)과 여수캠퍼스(전남 동부), 목포 남악고등학교(전남 서부)에서 ‘지역 대입전형 핵심교사 직무연수’를 3차례 개최했다.이번 연수에는 광주 ·전남 지역 고교 교사 180여 명이 참석해 변화하는 대입전형과 진로진학 지도에 대한 정보를 공유하고, 고교와 대학 간 교육 연계성 강화를 통한 공교육 활성화 방안을 모색했다.각 회차 당 2박3일 일정으로 진행된 이번 연수에서, 교사들은 학생부 위주의 대입전형이 사교육을 억제하고 공교육 활성화에 도움이 된다는 데 인식을 같이하고 이에 따른 효과적인 진학지도 방안이 무엇인지에 대해 고민하는 시간을 가졌다.이번 연수는 학생들의 진로상담과 진학설계를 연결해 지도할 수 있는 내용으로 프로그램을 꾸며 참여교사들의 만족도를 높였다는 평가를 들었다.특히 인문계열은 전남대학교 사회과학대학 장우권 교수가, 자연계열은 전남대학교  공과대학 강현욱 교수가 대학교육 환경과 교육과정, 고교와의 연계 프로그램 등에 대해 강의를 들려줘 교사들로부터 큰 호응을 받았다.노해섭  기자 nogary@▶ 주요 이슈의 재구성, 촌철살인 이미지 파일 '카드뉴스'▶ 농업과 내:일의 만남, ""나우올제 크로스미디어""<ⓒ세계를 보는 창 경제를 보는 눈, 아시아경제 무단전재 배포금지>",https://news.naver.com/main/read.nhn?mode=LSD&mid=sec&sid1=102&oid=277&aid=0003672656
